App ID;Repo Owner;Repo Name;Contributors
com.termux.api; termux; termux-api; fornwall ,dkramer95 ,tomty89 ,Auxilus ,its-pointless ,ackalker ,edupsousa ,brunelli ,kshvmdn ,tstein ,Wetitpig ,ZeppLu ,landfillbaby
com.thermatk.android.xf.fakegapps; thermatk; FakeGApps; thermatk ,bonanza123 ,haffenloher ,Bubu ,Poussinou ,geg2048
cz.antecky.netswitch; tantecky; android; tantecky
com.jereksel.libresubstratum; jereksel; Bucket; jereksel ,dimqua ,Poussinou
subreddit.android.appstore; d4rken; reddit-android-appstore; d4rken ,bobheadxi ,krissrex ,drivfe ,airon90 ,iacopodeenosee ,azharichenko ,aadamsdev ,buslov ,avipars ,HElwy ,veyndan ,azumukupoe ,crud3
de.j4velin.systemappmover; j4velin; SystemAppMover; j4velin ,AndreMommert ,TheDiamondYT1
io.github.lonamiwebs.klooni; LonamiWebs; Klooni1010; Lonami ,andidevi ,JustMeErazem
com.uberspot.a2048; uberspot; 2048-android; uberspot ,paulvi ,eighthave ,a4vi2r ,scompo ,RobinvanderVliet ,pierreduchemin ,Poussinou ,alexara ,amoseui ,dark159123 ,princessruthie ,shubham01 ,zygimantus
com.twobuntu.twobuntu; 2buntu; 2buntu-android-app; nathan-osman
nerd.tuxmobil.fahrplan.camp; tuxmobil; CampFahrplan; tuxmobil ,johnjohndoe ,cketti ,SubOptimal ,ligi
nerd.tuxmobil.fahrplan.congress; tuxmobil; CampFahrplan; tuxmobil ,johnjohndoe ,cketti ,SubOptimal ,ligi
org.ligi.fahrplan; ligi; CampFahrplan; johnjohndoe ,tuxmobil ,ligi ,cketti ,SubOptimal ,schildbach ,morgil ,MichaelRocks ,ninov
org.ligi.scr; ligi; SCR; ligi ,johnjohndoe
tf.nox.wifisetup; eqvinox; wifisetup; eqvinox ,synnack
info.metadude.android.congress.schedule; EventFahrplan; EventFahrplan; johnjohndoe ,tuxmobil ,cketti ,SubOptimal ,ligi ,schildbach ,codingcatgirl ,MichaelRocks ,grote
de.k3b.android.androFotoFinder; k3b; androFotoFinder; k3b ,keunes ,mary-kate ,luiscruz
com.markuspage.android.atimetracker; netmackan; ATimeTracker; linuxcaffe ,netmackan ,gelahcem ,vpenso ,guerda ,rutsky ,pbeckingham ,opensource21 ,sirekanyan
a2dp.Vol; jroal; a2dpvolume; jroal ,nabetaro ,hoadlck ,luiscruz ,uschindler ,cprhokie ,sle118
aarddict.android; aarddict; android; itkach ,marcelogp ,ce-4 ,doozan ,bittachi ,dliw ,sklart
ch.bailu.aat; bailuk; AAT; bailuk ,larkery
com.greenaddress.abcore; greenaddress; abcore; greenaddress ,Poussinou ,hobbysome
de.we.acaldav; ennswi; AndroidCaldavSyncAdapater; timoberger ,gggard ,eloo ,Enrico204 ,wildgarden ,matthesrieke ,yvesf ,jojoF ,kallegit1950 ,dlech ,Griffon26
me.dbarnett.acastus; DanielBarnett714; Acastus; DanielBarnett714 ,naofum
org.billthefarmer.accordion; billthefarmer; accordion; billthefarmer ,afmachado
anupam.acrylic; valerio-bozzolan; AcrylicPaint; valerio-bozzolan ,marcogagino-22 ,TheOpenSourceNinja ,toehead2001 ,anupam1525 ,mhurwicz ,nicolaselie ,proninyaroslav
de.rampro.activitydiary; ramack; ActivityDiary; ramack ,Poussinou
de.szalkowski.activitylauncher; butzist; ActivityLauncher; butzist ,amiryal ,codeman38 ,Poussinou ,waldyrious
ch.abertschi.adfree; abertschi; ad-free; abertschi
org.adaway; AdAway; AdAway; dschuermann ,0-kaladin ,PerfectSlayer ,DavisNT ,sanjay900 ,Lozone ,Joery ,mission712 ,Joshndroid ,Matttter ,edent ,ja-som ,pec0ra ,KreAch3R ,Cadiducho ,Phoenix09 ,dvdmunckhof ,rindeal ,ThomasSmallert ,Vankog ,Hainish ,d4rken ,icepuente ,muzena ,pylerSM ,strel ,tstaylor7
com.matoski.adbm; ilijamt; android-adbm; ilijamt
org.dgtale.icsimport; danielegobbetti; ICSImport; danielegobbetti ,David-Guillot
me.danielbarnett.addresstogps; DanielBarnett714; AddressToGPS; DanielBarnett714 ,n76
com.davidshewitt.admincontrol; linux-colonel; AdminControl; linux-colonel ,Poussinou
org.adw.launcher; AnderWeb; android_packages_apps_Launcher; AnderWeb ,takuo ,thiasB ,boombuler ,cyanogen ,zewt ,gmellini ,dsandler ,seast ,Eug89 ,Wysie ,kaydensigh ,prash ,jsharkey ,romainguy ,edulmartins ,levyitay ,walkingice ,LeonScroggins ,loxK ,zinx ,skarcha ,PomepuyN ,notmyHubG ,sebyx31 ,exiva ,kmobs ,wjax
com.games.boardgames.aeonsend; JanSvoboda; aeonsend-randomizer; JanSvoboda
io.github.phora.aeondroid; phora; AeonDroid; phora
org.afhdownloader; daktak; afh_downloader; daktak ,naofum
com.freerdp.afreerdp; FreeRDP; FreeRDP; awakecoding ,akallabeth ,bmiklautz ,hardening ,llyzs ,C-o-r-E ,nfedera ,mfleisz ,MartinHaimberger ,eledoux ,zhangzl2013 ,jsorg71 ,pjd ,vworkspace ,atong ,kiilerix ,realjiangms ,shlevy ,otavio ,ilammy ,rozhuk-im ,floppym ,DavBfr ,ondrejholy ,ccpp ,roman-b ,littlejawa ,filofel ,erbth ,dbungert ,chipitsine ,dpoe ,weizhenwei ,rjcorrig ,bceverly ,ptsekov ,zeha ,bradh ,ydal ,alama ,dodo040 ,Vinche59 ,ngraziano ,xhaakon ,AMV007 ,lysannschlegel ,richterger ,chihchun ,oshogbo ,dupondje ,repzilon ,bjcollins ,ben-cohen ,dvincent-devolutions ,giox069 ,Hobby-Student ,LawrenceK ,maksqwe ,nils-a ,zavadovsky ,CodeAbyss ,clivest ,louyihua ,nogginware ,pearsonalan ,aleksei-klv ,g-reno ,HenryJacques ,elupus ,jbd1986 ,nschneider ,RolKau ,SBoyNumber1 ,uplusplus ,SriRamanujam ,adambprotiviti ,lordcrc ,jmealins ,jgrandy-a8 ,nereocystis ,blino ,lunixoid ,toddmck ,grandpaul ,T3N4K4 ,ntwerdochlib ,psumbera ,ArvidNorr ,volth ,hypherion2 ,azenk ,baruchsiach ,bailli ,NiKiZe ,dlesaffre ,jukeks ,kwitaszczyk ,mouseyoo7 ,LK2000 ,Tarnyko ,mmeyer724 ,sunweaver ,nitomartinez ,rkondratenko ,simon-engledew ,ted-gould ,abma ,eroen ,alexpilotti ,h3xx ,austin987 ,bsagal ,hcgpalm ,perkerk ,sukhodolin ,hendwolt ,drred-caspian ,jaccobraat ,WarheadsSE ,kaliway ,meosborne ,peterh ,RonYaari ,dontsueme ,divineforge ,bigpjo ,blazee ,byteboon ,caramorsimon ,cedrozor ,clangm ,martijn-m ,tduboys ,MicahChase ,nathankidd ,tagunil ,absmall ,kilobyte ,alex7ce ,uglym8 ,aballier ,andreesteve ,abergmeier ,2asoft ,lluixhi ,AurimasF ,bmwiedemann ,eosrei ,ChickenPeanut ,MrCsabaToth ,dwmw2 ,souryogurt ,doughdemon ,floe ,florianholzapfel ,fdubois1 ,giacogiac ,myfreeweb ,speidy ,iiordanov ,hpdevx ,irichter ,weberhofer ,johnjmullen ,jonathankap ,kurtmc ,LookBehind ,manio ,untoldone ,mbaum2000 ,MikeMcQuaid ,mlt ,hardeepmonty ,pfmooney ,rzr ,pieterjanc ,rafcabezas ,thenextman ,iniserve ,scottt ,lanoxx ,serayrosh ,madsensh ,ShaunMaher ,dubrsl ,vinzent ,TingPing ,UndefBehavior ,vakartel ,woutershep ,xdqi ,kakaroto ,pykoder ,comicfans ,daixj-shterm ,ed-velez ,erobertor ,grpomega ,itsmikeeng ,jcrespo-asg ,maelnor ,mrthebunny ,pentagra ,pfpacket ,rinov ,invalid-email-address
dev.ukanth.ufirewall; ukanth; afwall; ukanth ,cernekee ,duckized ,Gitoffthelawn ,vzool ,rhansen ,GermainZ ,strooonger ,yongce ,sadam36 ,comradekingu ,kunall17 ,Magissia ,Phylon ,sanketplus ,an0n981 ,djechelon ,shenm233
us.achromaticmetaphor.agram; achromaticmetaphor; agram; achromaticmetaphor
systems.byteswap.aiproute; benjaminaigner; aiproute; benjaminaigner
tw.qtlin.mac.airunlocker; pinetum; AirUnlock-for-Android; pinetum ,gboudreau ,licaon-kter
dulleh.akhyou.fdroid; dulleh; akhyou; Error: repos/dulleh/akhyou/contributors was not found..
com.angrydoughnuts.android.alarmclock; kraigs-android; kraigsandroid; mesnevi ,mquinson ,pyg77 ,capaci
cz.jiriskorpil.amixerwebui; JiriSko; amixer-webui-android; JiriSko ,Poussinou
com.tomer.alwayson; rosenpin; AlwaysOnDisplayAmoled; rosenpin
tomer.com.alwaysonamoledplugin; rosenpin; AlwaysOnAmoledPlugin; rosenpin
com.amaze.filemanager; arpitkh96; AmazeFileManager; VishalNehra ,arpitkh96 ,EmmanuelMess ,TranceLove ,CMDRArtanis ,piotaixr ,smarquespt ,RobinvanderVliet ,pejakm ,yashwanthreddyg ,theck13 ,amalvarenga ,Bambooin ,proninyaroslav ,Unpublished ,Kucharskov ,martincz ,hawkeye116477 ,beriain ,PiwwowPants ,ngoisaosang ,Luca1991 ,MaanooAk ,RenaudR ,Primokorn ,mohammadi66 ,ygorigor ,jpage4500 ,pylerSM ,Foso ,Jawnnypoo ,pradyukrish ,N00byKing ,SimplicityApks ,krrr ,lilj ,moovida ,krt16s ,igor-dyatlov ,Josemsar ,kimbeejay ,Pavneet-Sing ,winsontan520 ,chinmayjatana ,danhantao ,lbdroid ,michaelsam94 ,RamolaWeb ,relan ,twckr ,kaneawk ,rupak0577 ,akretz ,aldatsa ,avuton ,Brli ,ByteHamster ,Minty123 ,dmitrio95 ,zhEdward ,gsantner ,preet90 ,georgiev-ilian ,kkfong ,prempalsingh ,Roboe ,shalzz ,sidakpreetn-optimus ,tbridges42 ,VasilisKos ,XiNFINiTY242 ,amtlib-dot-dll ,bzihufxq ,diegoflassa ,giuskiller ,italankin ,jakubparysz ,pasinir ,techwebpd ,maythiago ,txcv ,Felix2yu
com.sound.ampache; Dejvino; amdroid; Dejvino
org.ametro; RomanGolovanov; ametro; RomanGolovanov
kiwi.root.an2linuxclient; rootkiwi; an2linuxclient; rootkiwi ,Poussinou
com.example.root.analyticaltranslator; xpheres; AndroidAnalyticalTranslator; Error: repos/xpheres/AndroidAnalyticalTranslator/contributors was not found..
net.bible.android.activity; mjdenham; and-bible; mjdenham ,alerque ,tuomas2 ,balinjdl ,qmx ,wolfhawke
li.klass.fhem; klassm; andFHEM; klassm ,mamohr ,maniac103 ,Zoldan ,JasonMask ,hokascha ,ahinrichs
org.xapek.andiodine; yvesf; andiodine; yvesf ,jovial ,TijmenW ,ypid ,2m
com.gpl.rpg.AndorsTrail; Zukero; andors-trail; oskarwiksten ,Zukero ,ianh0 ,mchehab ,HummusSamurai ,Rijackson ,LucasDelvallet ,sdevaney ,carceris-magister ,necrose99 ,dacmot ,jirkadanek ,FlorianDoublet ,nijel ,NutAndor ,Xaver-Entropia ,arnaudcoj
org.shadowice.flocke.andotp; andOTP; andOTP; flocke ,0xbb ,RichyHBM ,mbertram ,DanielWeigl ,carmebar ,9Cube-dpustula ,x3rAx ,enwokoma ,SuperVirus ,johanfleury ,callmemagnus
com.fr3ts0n.ecu.gui.androbd; fr3ts0n; AndrOBD; fr3ts0n ,weblate ,emeric254 ,naofum ,yarons ,LafarM ,belkacem77 ,nijel ,comradekingu ,mansil ,SantosSi ,slsimic ,asaxena9021 ,hakuchi ,hcarnetta ,namoaton ,AurelianoBR ,Rastikh ,pikasingh ,sebras ,victorenator ,abdobim ,aqvayli ,sallecta ,kryskool ,DmitriySM1 ,isalgueiro ,joaopcmacha ,nenadnikolicns ,pfuender ,Ventto ,jmpz ,RaceManEn ,ramseslinux
io.github.benoitduffez.cupsprint; BenoitDuffez; AndroidCupsPrint; BenoitDuffez ,maniac103 ,Gemba ,theScrabi ,gtbX ,HubertZhang ,speachy ,naofum
com.iamtrk.androidexplorer; iamtrk; Device-Explorer; iamtrk
uk.co.bitethebullet.android.token; markmcavoy; androidtoken; neuhalje ,markmcavoy
org.androidpn.client; daktak; androidpn-client; daktak ,naofum
android.androidVNC; antlersoft; android-vnc-viewer; antlersoft
io.github.phora.androptpb; phora; AndroPTPB; phora
net.tedstein.AndroSS; tstein; AndroSS; orjanv ,arfoll ,tstein
org.andstatus.app; andstatus; andstatus; yvolk ,tbjers ,matthiasjordan ,vinzv ,moshpirit ,invalid-email-address ,cotsog ,kvnco ,jurf
io.gresse.hugo.anecdote; HugoGresse; Anecdote; HugoGresse ,mueller-ma ,dimqua ,knewzen
gq.nulldev.animeopenings.app; null-dev; animeopenings-android; null-dev ,JonathanMM ,Poussinou
com.ichi2.anki; ankidroid; Anki-Android; timrae ,nicolas-raoul ,nobnago ,flerda ,iniju ,hssm ,edu-zamora ,agrueneberg ,ospalh ,mandre ,daniel-svard ,Blaisorblade ,trashcutter ,dmitry-timofeev ,vanosten ,hanpingchinese ,trurlo ,t123 ,eginhard ,chajadan ,marek-jasovsky ,ingmar- ,Ramblurr ,kieranclancy ,diogovk ,antoineschweitzer ,cyrilmhansen ,jmfayard ,jberkel ,packlnd ,PabloRomanH ,mikehardy ,greencrab ,madhead ,jordi-chacon ,jvanprehn ,donald-w ,jshevek ,wlky ,grizzancs ,inglor ,johnjohndoe ,vfr-nl ,zakvdm ,stream101 ,bexsadirov ,the-kenny ,brennan-daguilar ,ray-pixar ,kerrickstaley ,arooooon ,knowlix ,federvieh ,IntendedConsequence ,exic ,mooingcat ,osondoar ,bogdanteleaga ,rubyu ,snowtimeglass ,thurd ,chengbo ,dae ,mateuszzz88 ,PtrToVoid ,alexander255 ,thanhan ,killerducky ,anti-r8s ,artsakenos ,tilusnet ,ransomw ,Bananeweizen ,drbubbletea ,strubul ,reinert ,ansonyao ,Nutomic ,fi3te ,geniass ,glutanimate ,ian-kelling ,isseis ,jkennethcarino ,JLRishe ,johndem ,jkl1337 ,JordanCleeve ,Acedio ,katrinleinweber ,kyleofori ,LePlatos ,LeopoldKellers ,martindisch ,athrun ,mattmccormick ,mawis ,michaelolson ,msylw ,ncpierson ,Oddegamra ,orolle ,PSeitz ,rouseabout ,zyzor ,Profpatsch ,rabinv ,bresan ,rillig ,tanzoniteblack ,thomasrebele ,vvs ,wsmigaj ,x-ji ,yshklarov ,adrek14 ,dequis ,elkmovie ,gravel ,kelciour ,leowalkling ,llunak ,meremortal ,rabite0 ,rbayer ,rvanprehn ,minimumcut ,tsudoko
de.ktran.anno1404warenrechner; tran-khoa; ANNO1404-Warenrechner-App; tran-khoa ,Poussinou
de.digisocken.anotherrss; no-go; AnotherRSS; no-go ,rbchinchen ,naofum
org.anothermonitor; AntonioRedondo; AnotherMonitor; AntonioRedondo ,djkovrik
An.stop; jdmonin; anstop; jdmonin
de.danoeh.antennapod; antennapod; AntennaPod; danieloeh ,mfietz ,TomHennen ,domingos86 ,ByteHamster ,patheticpat ,Cj-Malone ,orionlee ,keunes ,gaul ,rharriso ,TheRealFalcon ,udif ,dirkmueller ,peschmae0 ,orelogo ,mchelen ,dethstar ,drabux ,saqura ,hzulla ,MeirAtIMDDE ,johnjohndoe ,ligi ,VarunBarad ,dreiss ,hannesa2 ,liesen ,nereocystis ,twiceyuan ,volhol ,HolgerJeromin ,jmue ,katrinleinweber ,LatinSuD ,24hours ,SosoTughushi ,toggles ,CedricCabessa ,kingargyle ,hannesaa2 ,ShadowIce ,raghulj ,raghulrm ,stevomit ,tuxayo ,alanorth ,alexte ,andrey-krutov ,arantius ,chrissicool ,cszucko ,CWftw ,danielm5 ,brettle ,eirikv ,eerden ,jannic ,Kaligule ,luiscruz ,mo ,mschuetz ,MolarAmbiguity ,mounirlamouri ,eNBeWe ,ortylp ,SamWhited ,sonnayasomnambula ,sethoscope ,shantanahardy ,danners ,corecode ,edent ,atrus6 ,waylife ,axq ,lightonflux ,mateoeh ,minusf ,sevenmaster
ch.logixisland.anuto; reloZid; android-anuto; reloZid ,civyshk ,id101010 ,verdulo ,bn4t ,beothorn ,RyDroid ,smarek ,quaap ,larjona ,gomesar ,mvdan ,victorenator ,urbalazs ,georgenetu ,Almtesh ,JensKorte ,mquinson ,burunduk ,Poussinou ,sardach ,azzamsa ,foobar2016 ,stphnd ,wb9688
org.liberty.android.fantastischmemo; helloworld1; AnyMemo; helloworld1 ,monga ,xin041619 ,shixiaoyu ,xie-dongping ,verdulo ,twckr ,antonv6 ,f8l ,Ilari-t
com.menny.android.anysoftkeyboard; AnySoftKeyboard; AnySoftKeyboard; menny ,herrlado ,justinmichaud ,hdlopes ,Chahk ,kati42 ,andrewshadura ,friesenkiwi ,ViXXoR ,aldatsa ,PanderMusubi ,danielegobbetti ,lubekgc ,luiscruz ,marmistrz ,simon-v ,titoBouzout ,avently ,Shatur95 ,hezi ,jgkamat ,Blaimi ,suntabu ,steelman ,alex73 ,nvllsvm ,grimreaper ,nwf ,TheNetStriker
com.anysoftkeyboard.languagepack.french; AnySoftKeyboard; LanguagePack; menny ,friesenkiwi
com.anysoftkeyboard.languagepack.dutch; AnySoftKeyboard; LanguagePack; menny ,friesenkiwi
com.anysoftkeyboard.languagepack.basque; AnySoftKeyboard; LanguagePack; menny ,friesenkiwi
com.anysoftkeyboard.languagepack.brazilian; AnySoftKeyboard; LanguagePack; menny ,friesenkiwi
org.herrlado.ask.languagepack.czech; AnySoftKeyboard; LanguagePack; menny ,friesenkiwi
com.menny.anysoftkeyboard.finnish; AnySoftKeyboard; LanguagePack; menny ,friesenkiwi
com.anysoftkeyboard.languagepack.german; AnySoftKeyboard; LanguagePack; menny ,friesenkiwi
com.anysoftkeyboard.languagepack.greek; AnySoftKeyboard; LanguagePack; menny ,friesenkiwi
com.anysoftkeyboard.languagepack.hebrew; AnySoftKeyboard; LanguagePack; menny ,friesenkiwi
com.anysoftkeyboard.languagepack.icelandic; AnySoftKeyboard; LanguagePack; menny ,friesenkiwi
com.anysoftkeyboard.languagepack.italian; AnySoftKeyboard; LanguagePack; menny ,friesenkiwi
com.anysoftkeyboard.languagepack.latvian; AnySoftKeyboard; LanguagePack; menny ,friesenkiwi
com.anysoftkeyboard.languagepack.macedonian; AnySoftKeyboard; LanguagePack; menny ,friesenkiwi
com.anysoftkeyboard.languagepack.neo; kertase; neo_anysoftkeyboard; kertase ,leoschwarz ,pi3ch
com.anysoftkeyboard.languagepack.norwegian; AnySoftKeyboard; LanguagePack; menny ,friesenkiwi
com.anysoftkeyboard.languagepack.portuguese; AnySoftKeyboard; LanguagePack; menny ,friesenkiwi
com.anysoftkeyboard.languagepack.slovene; AnySoftKeyboard; LanguagePack; menny ,friesenkiwi
com.anysoftkeyboard.languagepack.spain; AnySoftKeyboard; LanguagePack; menny ,friesenkiwi
com.anysoftkeyboard.languagepack.swedish; AnySoftKeyboard; LanguagePack; menny ,friesenkiwi
com.anysoftkeyboard.languagepack.tatar; AnySoftKeyboard; LanguagePack; menny ,friesenkiwi
com.anysoftkeyboard.languagepack.ukrainian; AnySoftKeyboard; LanguagePack; menny ,friesenkiwi
com.anysoftkeyboard.languagepack.russian2; AnySoftKeyboard; LanguagePack; menny ,friesenkiwi
axp.tool.apkextractor; axxapy; apkExtractor; axxapy ,mueller-ma ,anasanasanas ,naofum
fr.kwiatkowski.ApkTrack; JusticeRage; ApkTrack; JusticeRage ,Olf0 ,tetsuo55 ,precla ,DJaeger ,Chamelleon ,pejakm ,Primokorn ,Poussinou ,keithzg ,invalid-email-address
com.simplemobiletools.applauncher; SimpleMobileTools; Simple-App-Launcher; tibbi ,Phoenix1747 ,smarquespt ,nikoss ,trubitsyn ,naofum ,vanitasvitae ,bla-ke ,mobtechpd ,Poussinou ,rex07 ,superusercode ,YSmhXQDd6Z ,fricyo ,kniddl ,mueller-ma
org.microg.nlp.backend.apple; microg; AppleWifiNlpBackend; mar-v-in ,KAMiKAZOW ,pejakm ,aelmahmoudy
com.majeur.applicationsinfo; MajeurAndroid; Applications-Info; MajeurAndroid
cx.hell.android.pdfview; mpietrzak; apv; mpietrzak ,arpruss ,ldrolez ,naseer ,lannic
com.jtmcn.archwiki.viewer; jtmcn; archwiki-viewer; jtmcn ,kevinhinterlong ,burntcookie90 ,nioncode ,arthurzam ,Poussinou ,mueller-ma
com.commonsware.android.arXiv; jdeslip; arxiv-mobile; benmoran ,jdeslip ,Poussinou ,sanchom
com.dozingcatsoftware.asciicam; dozingcat; AsciiCam; dozingcat ,arfoll ,abegosum
de.lsubel.amam; lsubel; amam-cordova; lsubel
org.asteroidos.sync; AsteroidOS; AsteroidOSSync; FlorentRevest ,weblate ,d9h20f ,daniellandau ,comradekingu ,elchevive ,p-bo ,emintufan ,Wendigogo ,yarons ,naofum ,bolbishvili ,tytan652 ,ilpianista ,belkacem77 ,Caballlero ,Etua ,MarcCeleiro ,Lisztena ,monolifed ,playday3008 ,Jojonintendo ,TheLastProject ,jsmakaayb ,utkabobr ,koma85 ,C0rby ,EpicLPer ,yiannakis ,lkristensen ,wrbl606 ,sesev ,toXel ,Tuxerito ,advocatux ,dom133 ,sqwerty13 ,c-e-p-x-u-o ,BrunoCrFr ,daduke ,danialbehzadi ,cavokz ,manulicious ,mruminski ,Araucarier ,nacirabrous ,Poussinou ,rizal-rovins ,KorakSilvercloud ,chesteran ,g1l3sp ,nils-developersinblue
org.tamanegi.atmosphere; lllllT; AtmosphereLogger; lllllT
indrora.atomic; indrora; Atomic; pocmo ,indrora ,steven676 ,liato ,remram44 ,paytonq ,democtezuma ,Kell ,kugel- ,jgeboski ,ZoogieZork ,rasher ,brion ,Brottweiler ,enikesha ,jcsogo ,waffle-iron ,mmastrac ,relrod ,tkn ,14mRh4X0r ,chantra ,diegok
net.nullsum.audinaut; nvllsvm; Audinaut; nvllsvm ,craftyguy
com.quaap.audiometer; quaap; AudioMeter; quaap ,naofum ,Poussinou
ut.ewh.audiometrytest; ReeceStevens; ut_ewh_audiometer_2014; ReeceStevens
com.rascarlo.aurdroid; rascarlo; AURdroid; rascarlo
net.tjado.passwdsafe; tejado; Authorizer; jefftharris ,tejado ,absturztaube ,Poussinou
org.miamplayer.autoairplanemode; MBach; AutoAirplaneMode; MBach ,krt16s ,Poussinou ,naofum
com.dosse.chromiumautoupdater; adolfintel; chromiumUpdater; adolfintel ,FriederZi ,NeverMine17 ,Slizzz ,TotalCaesar659
com.teamdc.stephendiniz.autoaway; DizzyThermal; Auto-Away; DizzyThermal
com.wolas.awesomewallpaper; vvolas; Awesome-Live-Wallpaper; vvolas ,licaon-kter
protect.babysleepsounds; brarcher; baby-sleep-sounds; brarcher ,loial ,Poussinou
fr.hnit.babyname; mdecorde; BABYNAME; mdecorde ,aliusa
com.pavelsikun.runinbackgroundpermissionsetter; MrBIMC; RunInBackgroundPermissionSetter; MrBIMC ,basemym ,adryx92 ,SlimShadys ,Poussinou
tk.al54.dev.badpixels; SibDev; BadPixels; alexws54tk
de.mangelow.balance; scheich; Balance; scheich ,alaasalman
com.liato.bankdroid; liato; android-bankdroid; liato ,goober ,fredrike ,walles ,magnusart ,robho ,Tuxie ,timtux ,mhagander ,PMC ,wicol ,jonasgroth ,erifre ,sed03 ,DEGE1 ,cortex ,d95andek ,emilan ,fredriklindberg ,firetech ,martach ,bjooork ,Snaah ,nadam ,wanders ,WizKid ,rhoot ,YoX89 ,nixi ,auno ,mikaeler ,NiclasI ,ScuttleSE ,gitter-badger ,MathiasBois ,lawi75 ,mafa73 ,oskla129
com.google.zxing.client.android; zxing; zxing; srowen ,medicalwei ,slepmog ,dsanders11 ,tanelihuuskonen ,micjahn ,mhcuervo ,burunduk ,yoshi389111 ,strguntbr ,MicheleMas ,UniQP ,Yahoe001 ,az-ericso ,QingfengLee ,t123yh ,mechkg ,Matrix44 ,mertemin ,xuthus ,t-8ch ,fgrieu ,mikejkjr ,tgibson11 ,herman1vdb ,rospus ,ahatzz11 ,awenger ,Coeur ,noplanman ,aldatsa ,Benjamin-Dobell ,shifucun ,BrunoMioto ,chriskeyring ,ChristianBecker ,laeubi ,dpeckett ,DandelionSprout ,gredler ,DarrellDuane ,Manouchehri ,Spelt ,facundofarias ,gitu ,frankFic ,graug ,Kbhredsox ,kmark ,KrasnayaPloshchad ,kent92 ,odahcam ,jjYBdx4IL ,mscheel ,mmhelm ,Flitskikker ,bimusiek ,nathbenjwolf ,nayuki ,ftylitak ,PedPak ,PeterDaveHello ,PhilLab ,RX1226 ,rkistner ,rmtheis ,rocboronat ,sebkur ,dsiddharth2 ,steffen-kiess ,TomTasche ,Veve2 ,Zavael ,codewell4 ,eliovir ,fakhri626 ,germinator ,lskocik ,mmagician ,omodai ,loikki ,steelman ,stevepeak ,tacsipacsi
net.szym.barnacle; szym; barnacle; szym
com.dougkeen.bart; dougkeen; BartRunnerAndroid; dougkeen ,invalid-email-address ,FuegoFro ,robertokl ,loadedion
org.basketbuilddownloader; daktak; basketbuild_downloader; daktak
org.jfet.batsHIIT; kwantam; batsHIIT; kwantam ,Poussinou
com.slash.batterychargelimit; sriharshaarangi; BatteryChargeLimit; milux ,xdnax ,sriharshaarangi ,AxelBlaz3 ,Himura2la ,AdroitAdorKhan ,BRB2000 ,caiorrs ,sm4rk0
com.enrico.earthquake.batterysimplysolid; enricocid; Battery-Live; enricocid ,JediBurrell ,urtxintxa ,naofum
com.darshancomputing.BatteryIndicator; darshan-; Battery-Indicator-Free; darshan-
com.darshancomputing.BatteryIndicatorPro; darshan-; Battery-Indicator-Pro; darshan-
com.samebits.beacon.locator; vitas; beaconloc; vitas ,Poussinou
com.knirirr.beecount; knirirr; BeeCount; knirirr ,krt16s ,Poussinou
com.vlath.keyboard; VladThodo; behe-keyboard; VladThodo ,Lennoard ,timkrief ,Shagon94 ,Poussinou ,RSCipher001 ,seigneurfuo
com.vlath.beheexplorer; VladThodo; behe-explorer; VladThodo
org.berlin_vegan.bvapp; Berlin-Vegan; berlin-vegan-guide; jmastr ,smeir ,micuintus ,ces92
com.javiersantos.whatsappbetaupdater; javiersantos; WhatsAppBetaUpdater; javiersantos ,ed-george ,JaviToro ,Bubu ,thoemmi ,deavmi ,nlsltz
de.arnefeil.bewegungsmelder; arnef; bewegungsmelder-android; innir ,arnef ,Poussinou
org.bienvenidoainternet.app; Renard1911; BaiApp; Renard1911 ,z411
com.biglybt.android.client; BiglySoftware; BiglyBT-Android; TuxPaper ,BiglyBT ,Shusshu ,Poussinou ,parg
ml.adamsprogs.bimba; apiote; Bimba; apiote ,Poussinou
com.ihunda.android.binauralbeat; GiorgioRegni; Binaural-Beats; GiorgioRegni ,SecUpwN ,antoniotari
net.iexos.musicalarm; iexos; BipolAlarm; iexos ,RyDroid
org.birthdayadapter; SufficientlySecure; birthday-adapter; dschuermann ,dmfs ,soneyworld ,edigiacomo ,regagain
saschpe.contactevents; saschpe; BirthdayCalendar; saschpe
com.btcontract.wallet; btcontract; wallet; btcontract ,naofum ,AndresJ551
de.schildbach.wallet; bitcoin-wallet; bitcoin-wallet; schildbach ,jonathancross ,oscarguindzberg ,DavisNT ,serans1 ,haplo ,shawe ,Gitju ,gustav-wildearth ,Macarse ,TheBlueMatt ,patheticpat ,zagaberoo ,Mirobit ,saivann ,pryds ,w-shackleton ,cornwarecjp ,dejvo ,langerhans ,mmazi ,pY4x3g ,sandakersmann ,taku0 ,thokon00 ,y12studio
de.schildbach.wallet_test; bitcoin-wallet; bitcoin-wallet; schildbach ,jonathancross ,oscarguindzberg ,DavisNT ,serans1 ,haplo ,shawe ,Gitju ,gustav-wildearth ,Macarse ,TheBlueMatt ,patheticpat ,zagaberoo ,Mirobit ,saivann ,pryds ,w-shackleton ,cornwarecjp ,dejvo ,langerhans ,mmazi ,pY4x3g ,sandakersmann ,taku0 ,thokon00 ,y12studio
de.bitsharesmunich.wallet; kenCode-de; bitshares-wallet; yasir1brahim ,martykan ,kenCode-de ,igorkashuba-softgrad ,roadscape ,linouxis9
org.ligi.blexplorer; ligi; BLExplorer; ligi
de.grobox.blitzmail; grote; BlitzMail; grote ,ByteHamster ,mvdan
org.blockinger.game; vocollapse; Blockinger; vocollapse
org.blokada.alarm; blokadaorg; blokada; kar ,Poussinou
org.scoutant.blokish; scoutant; blokish; scoutant ,alondene ,btimofeev ,afmachado ,Poussinou ,shlusiak ,williamtheaker
de.baumann.thema; scoute-dich; Baumann_Theme; scoute-dich ,thomas31415 ,beli3ver ,naofum
com.hermit.btreprap; pipakin; Android-Bluetooth-Reprap; pipakin
ru.sash0k.bluetooth_terminal; Sash0k; bluetooth-spp-terminal; Sash0k ,benjaminaigner
net.bluetoothviewer; janosgyerik; bluetoothviewer; janosgyerik
com.hexad.bluezime; kenkendk; android-bluez-ime; kenkendk
cxa.lineswallpaper; ghisguth; sunlight; ghisguth
com.zola.bmi; zikalify; BMI_Calculator; zikalify
org.bobstuff.bobball; bobthekingofegypt; BobBall; wesen1 ,rnauber ,verdulo ,bobthekingofegypt ,RyDroid ,guerda ,david-in-perth ,xinxinxinxinxin
mobi.boilr.boilr; drpout; boilr; andrefbsantos ,dllud ,weblate ,naofum ,janx ,yfdyh000 ,svetlemodry ,mfrasca ,nijel ,Tuuux ,Alexhp200 ,jirkadanek ,le-scribe ,AymanDF ,VaultDeveloper
org.beide.bomber; beide; Bomber-for-android; sophiehuiberts
me.johnmh.boogdroid; JohnMH; BoogDroid; jonan ,albfan ,JohnMH ,krt16s
com.eleybourn.bookcatalogue; eleybourn; Book-Catalogue; Grunthos ,eleybourn ,silin ,rwetzlmayr ,gvmelle ,Imkal ,DiabolusItalicus ,Djiko ,filipeximenes ,dklisiaris ,bitigchi ,jgaldo ,UmutCC ,burak ,CiaranG ,HydraxSkarrag ,GuillaumeSmaha ,novacej ,ogregoire
com.totsp.bookworm; charlieCollins; and-bookworm; 
com.quaap.bookymcbookface; quaap; BookyMcBookface; quaap
btools.routingapp; abrensch; brouter; abrensch ,ntruchsess ,nrenner ,Mincol ,cpesch ,midnightcomm ,ProBackup-nl ,markshiz ,matkoniecz ,Poussinou
com.nkanaev.comics; nkanaev; bubble; nkanaev ,dmarku ,georgenetu ,RyDroid
net.androgames.level; avianey; Level; avianey
com.notriddle.budget; notriddle; budget-envelopes; notriddle ,elopez ,S1aNT ,azapps ,djyotta ,twckr
protect.budgetwatch; brarcher; budget-watch; brarcher ,redfast00 ,georgenetu ,kalehmann ,clinchergt
me.alexghr.bulkshare.android.app2; alexghr; bulkshare; alexghr ,svetlemodry ,scumola ,naofum
ru.meefik.busybox; meefik; busybox; meefik ,KrasnayaPloshchad ,NHellFire ,joseichiban ,cloud9350 ,Phoenix09 ,Poussinou
de.c3nav.droid; c3nav; c3nav-android; raphaelm ,codingcatgirl ,ligi
info.guardianproject.cacert; guardianproject; cacert; n8fr8 ,eighthave ,abeluck
com.frozendevs.cache.cleaner; Frozen-Developers; android-cache-cleaner; lubo ,pejakm ,adam-dej ,RyDroid ,smarquespt ,meskobalazs ,WilliamBeltranC ,naofum
info.zwanenburg.caffeinetile; otaconix; caffeinetile; otaconix
