App ID;Repo Owner;Repo Name;Contributors
org.indywidualni.fblite; indywidualny; FaceSlim; indywidualny ,panenka ,pejakm ,drbeat ,Nutomic ,antun3s ,pecuna ,dic1911 ,davidlb ,gsantner ,ZeeRooo ,marciozomb13 ,trulex ,creativetrendsapps ,mathdatech ,fishman ,richardneish ,ThecaTTony ,frauhottelmann ,homersimpsons
com.gabm.fancyplaces; gabm; FancyPlaces; gabm
org.ligi.fast; ligi; FAST; ligi ,jfreax ,SebiderSushi ,talexop ,pserwylo ,ptrv ,cketti ,KennethPrentiss ,ShadowKyogre ,johnjohndoe ,easyaspi314 ,jpamills ,valerio-bozzolan ,naofum ,rangzen
org.fastergps; Free-Software-for-Android; FasterGPS; dschuermann ,CiaranG
com.fastaccess.github.libre; thermatk; FastHub-Libre; k0shk0sh ,dedepete ,yakov116 ,JediBurrell ,thermatk ,failex234 ,kutsan ,cozyplanes ,aadithyabk ,Dreamersoul ,ALiangLiang ,Rainer-Lang ,caiorrs ,maple3142 ,vvb2060 ,heinrichreimer ,Rintan ,veyndan ,azumukupoe ,Astro36 ,the-cybersapien ,dikiaap ,eygraber ,jonathan-caryl ,Raffaele74 ,Stargamers ,ptt-homme ,mistermantas ,KallyDev ,kejn ,alorma ,casz ,svenhofmann99 ,daniel-stoneuk ,arkon ,TheAndroidMaster ,JavierSegoviaCordoba ,chamini2 ,akkatracker ,sschuberth ,Wikiwix ,TheClashster ,alete89 ,alisentas ,arpitjindal97 ,BTaskaya ,Devifish ,Dimitrees ,olshevskiy87 ,JamesKingdom ,jobinrjohnson ,Jawnnypoo ,KcNirvana ,lucasvalenteds ,clockvoid ,matsubara0507 ,maicol07 ,NoahAndrews ,passsy ,petarov ,ziem ,abc873693 ,ShardulKoli ,sid-maddy ,smichel17 ,talhacohen ,gitter-badger ,VictorxD70 ,hejsekvojtech ,andylizi ,mueller-ma ,f0rb1d
link.standen.michael.fatesheets; ScreamingHawk; fate-sheets; ScreamingHawk ,JediBurrell ,psyanite
eu.devunit.fb_client; sebastianrakel; fb-client-android; sebastianrakel
org.geometerplus.zlibrary.ui.android; geometer; FBReaderJ; geometer ,vasiliy-bout ,lidoxod ,Trottel ,dyuranov ,matm ,bigfishcat ,ury0005 ,MaDill ,dlmv ,ffes ,biomanw ,sa2ajj ,tamo ,snowwlex ,pataquets ,horus68 ,dennis-sheil ,probil ,aplicatii-romanesti ,danieroux ,siebert ,t3d ,intari ,fotock ,snaury ,IgorMarques ,itkach ,liquiddandruff ,rusnavu ,boussouira ,alyst ,BeckyDTP ,eliovir ,MilanKral ,pxanych ,naofum ,tititake
com.simplemobiletools.filemanager; SimpleMobileTools; Simple-File-Manager; tibbi ,smarquespt ,trubitsyn ,Phoenix1747 ,RyDroid ,anthologist ,hanjoongcho ,mcbaze ,ltGuillaume ,en2sv ,gregory678 ,10cents ,mobtechpd ,nopitdotcom ,Sopor- ,mueller-ma ,naofum ,arodu ,bla-ke ,Poussinou ,rex07 ,rodymacedo ,superusercode ,YSmhXQDd6Z ,aligitor ,dugi991 ,fricyo ,kTyn9A9Kw3 ,kniddl ,safu9 ,vanitasvitae
me.murks.filmchecker; zouroboros; filmchecker; zouroboros
eu.faircode.finegeotag; M66B; FineGeotag; M66B ,an0n981 ,naofum ,orville87
org.mozilla.klar; mozilla-mobile; focus-android; pocmo ,ahunt ,ekager ,liuche ,npark-mozilla ,MickeyMoz ,mcomella ,boek ,siddware ,mastizada ,layely ,Jacquester ,Benestar ,bkmunar ,antlam ,shahbazahmed1269 ,mkaply ,codebu5ter ,sabbir044 ,grubdragon ,fercarcedo ,snorp ,Obaied ,alanorth ,gaul ,MatonAnthony ,Bringoff ,bbinto ,csadilek ,djKooks ,frozzare ,JohnKal ,JordanShaak ,JxSun ,joydeepsaha05 ,nosark ,ltedone ,markushi ,mauryat ,nikwen ,GammaBurst101 ,rmisev ,shikhart98 ,d6thsense ,tomer ,ingerul93 ,epq ,gonzalde ,harisankerPradeep ,isabelrios ,SrChip15 ,veyndan
eu.veldsoft.fish.rings; TodorBalabanov; FishRingsForAndroid; TodorBalabanov ,serbezki
com.workingagenda.fissure; polypmer; fissure-android; fenimore ,Swati4star ,naofum
com.simplemobiletools.flashlight; SimpleMobileTools; Simple-Flashlight; tibbi ,Phoenix1747 ,smarquespt ,chrjsorg ,trubitsyn ,bla-ke ,koulaxizis ,anthologist ,en2sv ,naofum ,vanitasvitae ,mobtechpd ,Sopor- ,superusercode ,YSmhXQDd6Z ,alpenblauwtje ,fricyo ,gregory678 ,hanjoongcho ,kTyn9A9Kw3 ,mueller-ma ,xinxinxinxinxin
ca.cmetcalfe.xposed.flatconnectivityicons; pR0Ps; FlatConnectivityIcons; pR0Ps
daniel_32.flexiblewallpaper; danielmeek32; FlexibleWallpaper; 
edu.cmu.cs.speech.tts.flite; happyalu; Flite-TTS-Engine-for-Android; happyalu ,alexander255
ryey.flock; renyuneyun; FLock; renyuneyun ,naofum
net.fred.feedex; FredJul; Flym; FredJul ,mhuhtala ,Urban82 ,madx666 ,zhaofengli ,MaDill ,pejakm ,sugree ,pelya ,suyashbhatt ,svetlemodry ,alpha-and-omega ,JozefJarosciak ,changwoo ,kiike ,Etuldan ,handschuh ,equeim ,beriain ,asirinelli ,easyaspi314 ,jlHertel ,LukeOwlclaw ,ahangarha ,webmagex ,sknorr ,flashlab ,chenjia404 ,hamonfor ,kalahiri
com.oakley.fon; gjedeer; androidwisprclient; gjedeer ,Frenzie ,joanfon ,jfisbein ,philfr42 ,naofum
com.iazasoft.footguy; elboza; footguy; elboza
cz.martykan.forecastie; martykan; forecastie; martykan ,robinpaulson ,SpiritCroc ,juanitobananas ,zoff99 ,icasdri ,vmazoyer ,runtep ,YSmhXQDd6Z ,beriain ,chanceVermilion ,abika ,Primokorn ,naofum ,di72nn ,Linkid ,uxcam-mobile ,dadosch ,artem-p ,splitowo ,carminemassarelli ,kompowiec ,AdamNiederer ,Arno-Wong ,BoBeR182 ,ArchangeGabriel ,badener95 ,Nutomic ,Zagur ,frankFic ,twikedk ,sballew ,SergeySharipov ,SkewedZeppelin ,gitter-badger ,amo13 ,bijanebrahimi ,cippaciong ,dimqua ,marcoM32 ,mrodarellis
jp.forkhub; jonan; ForkHub; kevinsawicki ,jonan ,rtyley ,atermenji ,jojosch ,Adman ,justinmuller ,VictorxD70 ,crazymaster ,rk4an ,xen0n ,vkavalchuk ,jmchuma ,nwalters512 ,XhmikosR ,Bananeweizen ,fadils ,vovayatsyuk ,equalsdanny ,mueller-ma ,Chiara-De-Liberato ,Meisolsson ,lacrosse ,AtakanB ,Dajo90 ,hzsweers ,kostaskoukouvis ,Kernald ,Blei ,seabornlee ,char16t ,kappa7194 ,lexs ,AmauryEsparza ,anupcowkur ,arthurzam ,gutobenn ,imcaspar ,Granddave ,EzraBrooks ,francisrath ,gjtorikian ,guhemama ,gyszalai ,HLandstrom ,peff ,maltzj ,kaloyan-raev ,KcNirvana ,krishnakumarp ,vikev ,manoelangelo ,nordberg ,MaximLoguncov ,NBonaparte ,INGBI ,ozandeniz ,pavlospt ,pfn ,PetiPandaRou ,dobau ,ricciardelli ,robertboloc ,anemator ,rodrigoargumedo ,rubenroy ,narutosanjiv ,Scoutman ,blogcin ,sbennett18 ,TheMolkaPL ,gautsson ,TomasValenta ,TrevorBasinger ,Unpublished ,VladRassokhin ,choweiyuan ,Xyaren ,sukso96100 ,yuvalabou ,anirudh-mehta ,bazilio91 ,coder3101 ,deluxghost ,grivos ,jzzhen ,kmav ,kompowiec ,vampelf ,minsOne ,oneill ,ozlemkiziltug ,phstudy ,saran2020 ,weitsai
org.softeg.slartus.forpdaplus; slartus; 4pdaClient-plus; RadiationX ,iSanechek ,slartus ,sholohov
net.khertan.forrunners; khertan; ForRunners; natrius ,brvier ,Nutomic ,c1c1 ,jimbudarz ,jedie ,luiscruz ,Nicop06 ,Riotism ,gitter-badger
org.legtux.m_316k.fortune; 316k; android-fortune; 316k
be.digitalia.fosdem; cbeyls; fosdem-companion-android; cbeyls ,EdwardBetts ,Poussinou
org.fossasia.openevent; fossasia; open-event-android; mananwason ,the-dagger ,championswimmer ,creativepsyco ,mariobehling ,iamareebjamal ,Shailesh351 ,arp95 ,niranjan94 ,srv-twry ,opticod ,harshitagupta30 ,nikit19 ,mayank8318 ,rohanagarwal94 ,free4murad ,mahikaw ,PareshMayani ,shreyasnbhat ,utkarshnath ,manav-mj ,heysadboy ,chiragw15 ,amitiwary999 ,simarsingh24 ,shivenmian ,brainbreaker ,gogeta95 ,sriramr98 ,rhemon ,dreadpool2 ,AkshayCHD ,geeteshk ,ParthivMangukiya ,betterclever ,aakashkhatter1296 ,Elgayar ,suheb ,vjs3 ,mRokita ,jodiwaljay ,batraabhishek ,abishekvashok ,raj10071997 ,divs4debu ,gaeun ,seadog007 ,leeyh20 ,niccokunzmann ,piyush0 ,pulakdp ,Rishabhk07 ,rishz ,sanchittechnogeek ,codedsun ,Yathannsh ,chhavip ,pipix51 ,shivaraju07 ,sch00lb0y ,ani27 ,saketkumar95 ,abs51295 ,akashagra ,Heredroky ,mejariamol ,AndikaArya ,jindalAnuj ,anuraagbaishya ,97balakrishnan ,DavidPacioianu ,divyabaid16 ,friederbluemle ,thegalang ,hardik124 ,humazed ,jenish9599 ,Jonsnow21 ,yukiisbored ,Kartik2016 ,KnifesmithCode ,dhluong90 ,manki11 ,MaxBorsch ,mohitmanuja ,ahsan44411 ,m-murad ,nisrulz ,oanarosca ,omar753sahl ,omkarprabhu-98 ,priyankvex ,doomers ,rideep ,RamolaWeb ,samsruti ,S2606 ,souravbadami ,SparshWadhwa ,SparshBansal ,TejasBhitle ,hoangvanthien ,jainkuniya ,abhishekjiitr ,idealadarsh ,ddx-510 ,kaine119 ,manastaneja ,naofum ,nikhilbalyan ,Satyam26 ,sukhbir-singh
org.pixmob.freemobile.netstat; gilbsgilbs; freemobilenetstat; JakeWharton ,alexandreroman ,gilbsgilbs ,vdavy ,chrisbanes ,SimonVT ,zhen9ao ,scottkennedy ,casidiablo ,mernen ,gabrielittner ,mrenouf ,xperimental ,veeti ,zachlipton ,yanchenko ,Alyaron ,avram ,imminent ,wuman ,scompt ,felixb ,franklinharper ,josephpage ,wellsie1116 ,aectann ,hameno ,pierrre ,cuu508 ,gentlecat ,UweTrottmann ,arusahni ,mccob ,nacitar ,wlowe
de.saschahlusiak.freebloks; shlusiak; Freebloks-Android; shlusiak ,janisozaur ,afmachado ,RomFouq ,Poussinou ,naofum ,xinxinxinxinxin
org.freeminer.freeminer; freeminer; freeminer; proller ,celeron55 ,kwolekr ,est31 ,ShadowNinja ,kahrl ,PilzAdam ,paramat ,erlehmann ,nerzhul ,sfan5 ,RealBadAngel ,Zeno- ,Oblomov ,donat-b ,BlockMen ,Ekdohibs ,SmallJoker ,SpeedProg ,kaeza ,kilbith ,MirceaKitsune ,CiaranG ,sofar ,rubenwardy ,Rogier-5 ,alexxvk ,gregorycu ,lhofhansl ,darkrose ,minetest-services ,Queatz ,Jeija ,t4im ,arsdragonfly ,doserj ,matttpt ,JakubVanek ,HybridDog ,ngosang ,srifqi ,s8321414 ,anton-tsyganenko ,EXio4 ,Warr1024 ,neoascetic ,joancipria ,0gb-us ,TeddyDesTodes ,duane-r ,MoNTE48 ,AlfredoRamos ,Zeg9 ,sweetbomber ,DarkDracoon ,davisonio ,t0suj4 ,flyx ,neuschaefer ,jorgejarai ,red-001 ,AMDmi3 ,aracnus ,mito551 ,KodexKy ,RobertZenz ,khonkhortisan ,raymoo ,dannydark ,Bahamada ,TriBlade9 ,pilino1234 ,Foghrye4 ,artur99 ,Lord89James ,socramazibi ,apoleon ,Calinou ,juhdanad ,14NGiestas ,Sokomine ,Rui-Minetest ,xunto ,BrunoMine ,bark10 ,susnux ,Fixer-007 ,EvoIykane ,jnumm ,larjona ,mitch323 ,anxolerd ,elagin ,weedy ,fz72 ,orwell96 ,q66 ,tenplus1 ,zhangjunphy ,mahmutelmas06 ,MillersMan ,onkrot ,Elinvention ,jayarndt ,Etzos ,jristz ,renegade2k ,Betacentury ,gsmanners ,4Evergreen4 ,4aiman ,nolsen42 ,adrido ,asl97 ,Sorichan ,voronaam ,Amaz1 ,bendeutsch ,Bremaweb ,BreadT ,ChaosWormz ,claybiockiller ,fernando-msj ,devnexen ,davidgumberg ,eidy ,Enki4 ,Ferk ,reisfe ,Gael-de-Sailly ,TTChangeTheWorld ,wilkgr76 ,jimi15 ,Jibec ,Anchakor ,JoaoGFarias ,kirbykirby ,LS-Steeef ,LeMagnesium ,beyondlimits ,mdoege ,Mailaender ,Megaf ,nijel ,buckket ,CrazyLegoMind ,pehala ,pinkysnowman ,hexafraction ,Sasikaa ,inkelyad ,Snipie ,bluebear94 ,frozon ,Thomas--S ,tobyplowy ,nanase ,vldm ,infmagic2047 ,dngulin ,hasufell ,lisacvuk ,Selat ,stormchaser3000 ,theraven262 ,ekifox ,NaruTrey ,tomasbrod ,fwhcat ,thePalindrome ,ir0nknight ,IIIullaIII ,tacirus ,Uberi ,AntonBoch1244 ,ArtSin ,bernardosulzbach ,BluebirdGreycoat ,bhull2010 ,CasimirKaPazi ,JohnWayne1986 ,ChriPiv ,dfelinto ,Tracerneo ,Inifield ,Falmarri ,davexunit ,sda97ghb ,DonBatman ,ElementW ,vargad ,TheElixZammuto ,EricMountain ,evermedina ,ExcaliburZero ,FessWolf ,frantiseksimorda ,supra63200 ,HEXcube ,ignatenkobrain ,UgnilJoZ ,nitro2010 ,Joedalton2 ,lonniganseaweed ,furniman ,joshbeck ,ZehLuckmann ,leotada ,akmc ,LORDMUSIC ,SilverLuke ,mark7 ,mat8913 ,mamoit ,MineYosh ,Mikaela ,Miner59 ,Artoria2e5 ,indivisibleatom ,mushiden ,Nikolay0054 ,OdnetninI ,PenguinDad ,pmikkelsen ,rafael7 ,OldCoder ,rroobbeerr ,NeoMahler ,lakersforce ,russplaysguitar ,ryansnewell ,akien-mga ,ssieb ,graknol ,stefanbeller ,blha303 ,easehack ,TOMats3 ,Wayward1 ,AWTom ,WolfgangFellger ,Wuzzy2 ,yfdyh000 ,yamanq ,bekicot ,YvanYr ,zygimantus ,akiyamaakira ,bcnjr5 ,bse666 ,ch98-1 ,cheapie ,devo8604 ,dvere ,fishyWET ,hahoyer ,ikmaak ,jh10001 ,jordan4ibanez ,Kinokoio ,mich1 ,mimilus ,mtango688 ,nedzadarek ,netinetwalker ,obneq ,paly2 ,pandaro ,poet-nohit ,qiukeren ,slemonide ,livingBEEF ,tonibm19 ,taz1232 ,way-hu ,AlexYst ,yuv-h
org.fedorahosted.freeotp; freeotp; freeotp-android; npmccallum ,joekir ,bufferoverflow ,max-wittig ,urbalazs ,jharting ,tycho ,eszjay
org.liberty.android.freeotpplus; helloworld1; FreeOTPPlus; npmccallum ,helloworld1 ,GameScripting ,jharting ,Poussinou
de.cwde.freeshisen; knilch0r; freeshisen; knilch0r ,Poussinou
com.example.tobiastrumm.freifunkautoconnect; WIStudent; FreifunkAutoConnectApp; WIStudent ,guerda ,FreifunkUFO ,mattsches ,Tobi042 ,matmai
ca.rmen.android.frenchcalendar; caarmen; FRCAndroidWidget; caarmen ,BoD ,Poussinou ,beriain
com.dkanada.icecons; dkanada; frost; dkanada ,conrad-heimbold ,1C3 ,ikocevski ,MisterChief53 ,licaon-kter
org.jfedor.frozenbubble; videogameboy76; frozenbubbleandroid; videogameboy76 ,Poussinou ,amalvarenga ,danielluehr
sk.halmi.fbeditplus; videogameboy76; FBEditPlus; videogameboy76
be.ppareit.swiftp_free; ppareit; swiftp; ppareit ,ashutoshgngwr ,j3l11234 ,nikoss ,pejakm ,djMesias ,naofum ,valerio-bozzolan ,valentind44 ,Poussinou ,AndroidOL ,relan ,Pontorez
click.dummer.funphonepuppet; no-go; FunPhonePuppet; no-go
org.cipherdyne.fwknop2; jp-bennett; fwknop2; jp-bennett ,mrash ,quincunx ,tombriden ,micha137
de.baumann.browser; scoute-dich; browser; scoute-dich ,lishoujun ,element54 ,futrDevelopment ,splinet ,JumpingYang001 ,Bubu ,Poussinou ,Secangkir-Kopi
nodomain.freeyourgadget.gadgetbridge; Freeyourgadget; Gadgetbridge; ashimokawa ,cpfeiffer ,danielegobbetti ,jpbarraca ,Jojonintendo ,yarons ,protomors ,TaaviE ,ivanovlev ,mueller-ma ,comradekingu ,cpu20 ,youzhiran ,naofum ,roidelapluie ,c4ndel4 ,bytehala ,stepardo ,maufl ,sarg ,JohnnySun ,joserebelo ,rbarat ,albertsal ,edoz90 ,uwehermann ,Almtesh ,0nse ,geripgeri ,Vebryn ,6arms1leg ,computerlyrik ,Octopusss ,trigrab ,masakoodaa ,AnthonyDiGirolamo ,Zagur ,MigNov ,Mnkai ,normano64 ,tstein ,azuwis ,mesnevi ,nautilusx ,walkjivefly ,KazWolfe ,NotAFile ,aafa ,Allen-B1 ,andrewheadricke ,chrisperelstein ,DavisNT ,gabethecabbage ,hackoder ,Ivan4537 ,Puzzlehead0 ,devfreedom ,KashaMalaga ,beschoenen ,leleobhz ,Lowerman ,schlamar ,McSym28 ,Moarc ,white-gecko ,nico202 ,burunduk ,freilichthirn ,legioner0 ,Quallenauge ,rplevka ,thedroidgeek ,slp ,pragmaware ,mtsekm ,tradej ,rosenpin ,Medvech ,ya-isakov ,atkyritsis ,batatas ,bucala ,criogenic ,freezed-or-frozen ,kevlarcade ,ladbsoft ,lazarosfs ,michaelneu ,redking974 ,xphnx ,DaniPhii
com.murrayc.galaxyzoo.app; murraycu; android-galaxyzoo; murraycu ,avitaker ,krt16s ,egore ,PanderMusubi ,hobeika ,stream101
com.simplemobiletools.gallery; SimpleMobileTools; Simple-Gallery; tibbi ,solokot ,smarquespt ,ltGuillaume ,Phoenix1747 ,trubitsyn ,mcbaze ,gregory678 ,Solatec ,Pzqqt ,fiepi ,KrasnayaPloshchad ,fricyo ,FTno ,rodymacedo ,xmgz ,gh123man ,hanjoongcho ,kniddl ,crusepath ,en2sv ,Vdragon ,marciozomb13 ,Sopor- ,RyDroid ,Primokorn ,nopeppermint ,gcalzo ,mueller-ma ,AVM77 ,Lonami ,MasTu ,WanderMax ,alpenblauwtje ,anthologist ,naofum ,sebastian05067 ,vanitasvitae ,xinxinxinxinxin ,varakh ,arodu ,nvllsvm ,bla-ke ,Doess88 ,edcaron ,Gan0k ,dorkster ,mobtechpd ,larjona ,auanasgheps ,Poussinou ,rex07 ,sotcha ,xsoh ,superusercode ,mamizu ,YSmhXQDd6Z ,datzuma ,dugi991 ,j-biernacki ,jbembennek ,julianaito ,kTyn9A9Kw3 ,matiasblomqvist ,mrvak ,seigneurfuo ,tcg2008
com.tobykurien.google_news; tobykurien; GoogleNews; tobykurien ,otakuchiyan ,danielegobbetti
com.mridang.speedo; mridang; gasflow; mridang
org.sugr.gearshift; urandom; gearshift; urandom ,patton82 ,work40 ,Choukajohn ,BytEvil ,dinyar ,Weishaupt ,gbabin
se.pp.mc.android.Gerberoid; zeldin; Gerberoid; zeldin ,Poussinou
name.seguri.android.getforegroundactivity; seguri; GetForegroundActivity; seguri
com.github.ruleant.getback_gps; ruleant; getback_gps; ruleant ,weblate ,nijel ,jsseb ,jsmakaayb ,mregazzi ,chobkwon ,naofum ,asereze ,comradekingu ,zixtor ,ldmpub ,alunacast38 ,unomano ,yfdyh000 ,Enygma2002 ,eridrivic ,nascimentolwtn ,Swyter ,urbalazs ,bitdeli-chef ,Calinou ,Cris682 ,Etua ,Vistaus ,stubb ,razor74 ,sevdimali ,victorenator ,rezakhn
com.anddevw.getchromium; andDevW; getChromium; andDevW ,temtemy ,Bubu
at.bitfire.gfxtablet; rfc2822; GfxTablet; rfc2822 ,akdor1154 ,KevinLi ,romke ,techtonik
protect.gift_card_guard; brarcher; gift-card-guard; brarcher ,Poussinou
net.gaast.giggity; Wilm0r; giggity; Wilm0r ,insomniacslk ,heysadboy ,mmuman ,maks ,stefanor ,t-8ch
org.mariotaku.imageviewergl; mariotaku; imageviewer-gl; Error: repos/mariotaku/imageviewer-gl/contributors was not found..
org.zamedev.gloomydungeons2.opensource; restorer; gloomy-dungeons-2; restorer ,le5h ,minsko ,Poussinou ,AymanDF
at.linuxtage.companion; linuxtage; glt-companion; cbeyls ,flowolf ,Rufus125 ,EdwardBetts ,Poussinou
org.glucosio.android; Glucosio; android; paolorotolo ,emartynov ,glucat ,bkerensa ,ahhmarr ,alxsimo ,issacnitin ,HarKoss ,rotolonico ,amouly ,piotrek1543 ,raacker ,Ghazghkull ,apicellaj ,pt2121 ,riskysnail ,kaindl ,Poussinou ,rcd27 ,ArunSelvam11 ,chwalters ,dkhmelenko ,IamSSam ,harshadsabne ,jurrabi ,JoaquimLey ,lgp171188 ,waffle-iron ,jeonsoh ,jhlee1108 ,racell ,Ksj7
de.duenndns.gmdice; ge0rg; gamemasterdice; ge0rg ,dpflug
org.ligi.gobandroid_hd; ligi; gobandroid; ligi ,oren740 ,icehong ,gthazmatt ,inohiroki ,sligocki ,soli ,paddyzab ,Zenigata
org.asdtm.goodweather; qqq3; good-weather; qqq3 ,monolifed ,mahula ,beriain ,comradekingu ,marcoM32 ,thuryn ,Hanzei ,belkacem77 ,victorenator ,nikoss ,tonghuix ,Zagur ,lna91 ,Vistaus ,larvamedia ,ElWali ,tinhdk1 ,weblate ,naofum ,sebastiaopf ,marcositz ,mohabdul19 ,ulrixxx
org.happysanta.gd; evgenyzinoviev; gravitydefied; 
com.greenaddress.greenbits_android_wallet; greenaddress; GreenBits; greenaddress ,jgriffiths ,instagibbs ,zidagar ,jkozera ,RCasatta ,Kirvx ,jtimon ,btchip ,the9ull ,roosmaa ,Poussinou
com.greenaddress.greenbits_android_wallet.testnet; greenaddress; GreenBits; greenaddress ,jgriffiths ,instagibbs ,zidagar ,jkozera ,RCasatta ,Kirvx ,jtimon ,btchip ,the9ull ,roosmaa ,Poussinou
it.lucci.cm.greyscaletheme; gabrielelucci; greyscale-cmte   ; Error: repos/gabrielelucci/greyscale-cmte   /contributors was not found..
com.wbrenna.gtfsoffline; wbrenna; GTFSOffline; wbrenna ,matthewseal
ru.zxalexis.ugaday; zxalexis; guess; zxalexis
com.goltzkiste.guessaday; mo271; guessaday; mo271 ,Poussinou
com.tasomaniac.dashclock.hackerspace.floss; tasomaniac; hackdash; tasomaniac ,Poussinou ,naofum
org.pocketworkstation.pckeyboard; klausw; hackerskeyboard; klausw ,satok16 ,kruton ,dsalt ,dsandler ,wangying1015 ,jham ,kmonsen ,galeksandrp ,bjbeare ,dmitriplotnikov ,roubert ,jmtrivi ,LeonScroggins ,rypervenche ,fahrstuhl
net.tapi.handynotes; atd; HandyNotes; atd ,a1291762 ,jstamp ,leomcabral
ca.mimic.apphangar; corcoran; Hangar; corcoran
com.haha01haha01.harail; haha01haha01; HaRail_Android; haha01haha01 ,SweetLion
de.kodejak.hashr; kodejak; Hashr; kodejak ,ThorstenDietersen ,SweetLion
com.hayaisoftware.launcher; seizonsenryaku; HayaiLauncher; seizonsenryaku ,daltonos ,twckr ,thereiskeks ,RyDroid ,volnes ,earosb ,uberspot ,artur9010 ,llebegue ,avh4
me.hda.urlhda; cryptofuture; urlhda-android; cryptofuture
ch.blinkenlights.android.vanillaplug; vanilla-music; vanilla-headphone-detector; adrian-bl ,relan ,aminb ,meskobalazs ,seigneurfuo
de.cweiske.headphoneindicator; cweiske; headphoneindicator; cweiske
com.borneq.heregpslocation; borneq; HereGPSLocation; ByteHamster ,borneq
net.damsy.soupeaucaillou.heriswap; SoupeauCaillou; heriswap; peppsac ,bagage
com.eneko.hexcolortimewallpaper; jajasuperman; HexColorTime; urtxintxa ,naofum
de.baumann.hhsmoodle; scoute-dich; HHSMoodle; scoute-dich
com.manuelmaly.hn; manmal; hn-android; manmal ,maltzj ,peshkira ,tbroadley ,gliptak ,A-deLuna ,danieldisu ,noloman ,averageapps ,vafada ,vrischmann ,ceggert ,clancychilds ,mparramont ,vikas0380
com.holokenmod; queler; holokenmod; queler ,tortuca
io.homeassistant.android; Maxr1998; home-assistant-Android; Maxr1998 ,swbradshaw ,apo-mak ,naofum
io.github.hopedia; HopEdia; android-client; koko-ng ,Poussinou
com.smorgasbork.hotdeath; jpriebe; hotdeath; jpriebe
com.alaskalinuxuser.hourglass; alaskalinuxuser; app_hourglass; alaskalinuxuser ,Poussinou
com.derek_s.hubble_gallery; derekcsm; hubble_gallery; derekcsm ,bvasiljevic ,ValaDG ,PedroVictorB ,twckr ,Poussinou
com.kostmo.wallpaper.spiral; kostmo; android-spiral-wallpaper; 
ovh.ice.icecons; 1C3; ICEcons; 1C3 ,licaon-kter
com.cradle.iitc_mobile; jonatkins; ingress-intel-total-conversion; jonatkins ,leCradle ,fkloft ,breunigs ,Xelio ,vita10gy ,Fragger ,hastarin ,boombuler ,numinit ,nexushoratio ,dingram ,McBen ,cmrn ,JasonMillward ,BlakeOrth ,sorgo ,Costaspap ,scrool ,qnstie ,3ch01c ,cathesaurus ,Hobadee ,xosofox ,framed ,parabola949 ,teo96 ,azack ,Merovius ,saithis ,strguntbr ,reckter ,epf ,gabrielsjoberg ,Pirozek ,vbfox ,ShawnTuatara ,enigmaquip ,nhamer ,goodsoft ,Bananeweizen ,j16sdiz ,gluck ,waynn ,Fly33 ,JSponaugle ,Marx314 ,superdhuang ,sutepasu ,Beakerboy ,Diskordia ,e-nomem ,Galfinite ,JaCoB1123 ,michaeldever ,sollie ,Ashtoruin ,FesterCluck ,neuhaus ,harisbitsakou ,khabraken ,badluck13 ,breeswish ,bbarao ,strobel1x ,gnarf ,Dunstkreis ,EdJoPaTo ,dodomorandi ,Guria ,hexchain ,inye ,revolter ,wernicke81 ,JensenDied ,firetech ,ccjon ,justinnoah ,kitor ,lablua ,markfguerra ,mattiasb ,Blaisorblade ,FrzMe ,pleasantone ,richbradshaw ,ssergni-smith ,terencehonles ,tzafrir ,waldyrious ,Zaldor ,billybennett ,bradgarner ,eidyia ,fran1987 ,fstopienski ,imsaguy ,mledoze ,richseviora ,rlc4 ,rongou ,stephninja ,szliyang ,winkelement ,wrycta
com.Pau.ImapNotes2; nbenm; ImapNote2; nbenm ,capi
net.inbox.pager; itprojects; InboxPager; itprojects
x1125io.initdlight; x1125; initd-light; x1125
de.k3b.android.intentintercept; k3b; intent-intercept; intrications ,k3b ,larsgrefer ,codebymikey ,AymanDF ,jamesots ,Poussinou ,laurencemeynell ,autovalue ,minipif
uk.co.ashtonbrsc.android.intentintercept; intrications; intent-intercept; intrications ,k3b ,larsgrefer ,AymanDF ,codebymikey ,jamesots ,laurencemeynell ,autovalue ,minipif
org.smblott.intentradio; smblott-github; intent_radio; smblott-github
org.flyve.inventory.agent; flyve-mdm; android-inventory-agent; rafaelje ,Naylin15 ,ajsb85 ,kiniou ,teclib-bot ,goneri ,wawax ,ddurieux ,erufu
nodom.darkfm.inventoryguimobile; salvadorp2001; Inventory_Taker; salvadorp2001 ,Poussinou
org.asdtm.fas; qqq3; inventum; qqq3 ,verdulo ,naofum
org.ligi.ipfsdroid; ligi; IPFSDroid; ligi ,hobofan
org.woltage.irssiconnectbot; irssiconnectbot; irssiconnectbot; kruton ,jsharkey ,woltage ,Villae ,mmatuska ,AgentHH ,adamwg ,riksa ,parkerkane ,alademan ,douglaswth ,ge0rg ,pfn ,cboylan ,gkatsev ,IEF ,julianbrost ,mkj ,sangh ,xhochy ,joppuyo
name.seguri.android.isphoneencrypted; seguri; IsPhoneEncrypted; seguri
eu.veldsoft.ithaka.board.game; TodorBalabanov; IthakaBoardGame; TodorBalabanov
com.iven.lfflfeedreader; enricocid; lffl-feed-reader; enricocid
im.r_c.android.jigsaw; richardchien; jigsaw-android; richardchien ,naofum
com.teleca.jamendo; telecapoland; jamendo-android; MarcinGil ,dargad ,jessicabarbalho ,thalesalexcin ,vishna ,plinlwis
com.aragaer.jtt; aragaer; jtt_android; aragaer ,tinxx ,Poussinou
is.pinterjann.jaws; jannispinter; jaws; jannispinter ,GreenLunar
org.voidsink.anewjkuapp; marunjar; anewjkuapp; marunjar ,LeonardoDavinci ,rnbdsh
com.jtechme.jumpgo; JTechMe; JumpGo; nutellarlz ,Primokorn ,licaon-kter ,zygimantus
uk.co.jarofgreen.JustADamnCompass; jarofgreen; Just-A-Damn-Compass; jarofgreen
com.alaskalinuxuser.justcraigslist; alaskalinuxuser; app_justcraigslist; alaskalinuxuser
com.alaskalinuxuser.justnotes; alaskalinuxuser; app_justnotes; alaskalinuxuser ,Poussinou ,naofum ,trikaphundo
co.pxhouse.sas; veniosg; JustSearch; veniosg ,gabrielelucci ,Poussinou
com.fsck.k9; k9mail; k-9; cketti ,obra ,Valodim ,danapple ,andrewachen ,philipwhiuk ,zjw ,baolongnt ,jca02266 ,Fiouz ,dzan ,jberkel ,maniac103 ,rabcyr ,artbristol ,dnet ,dschuermann ,ismarc ,thialfihar ,gaul ,MarcusWolschon ,m0vie ,bradleyy ,janekx ,rk4an ,ApoorvKhatreja ,Uni- ,jkinnunen ,tobiasbaum ,pylerSM ,jyn514 ,bitblaster ,ligi ,igavio ,bboa ,rhari991 ,wongk ,kiike ,GoneUp ,Trogel ,sunglim ,frommeyerc ,jonas-lundqvist ,marciozomb13 ,mnb20 ,vcaulier ,YESALAM ,Mama59 ,mallamanis ,xperimental ,roee88 ,daquexian ,wilian-cb ,joaopedrotaveira ,sq5gvm ,tibbetts ,0x2102 ,raboof ,hendrikbl ,mawiegand ,mkj ,dotnick ,srinathwarrier ,tbolender ,alexandre75 ,korelstar ,miguelpinheiro ,vt0r ,chrisbanes ,justdave ,frankdu ,qazrfv1234 ,leonhandreke ,Mittaa ,RootRulez ,sebkur ,PokerFace8 ,TETRA2000 ,foxban ,bk2204 ,diegomaninetti ,eagan ,ployt0 ,markcapella ,morckx ,mynimu ,ndew623 ,nysatrok ,qvandekadsye ,s3b- ,sedrubal ,AllanWang ,dalevizo ,alecpl ,alenzen ,emanov ,andriykopanytsia ,archie-sh ,clawoflight ,Biswajee ,bashrc ,krt16s ,crr0004 ,Plunts ,christianknecht ,danwain ,uniqueid001 ,dmitryash ,asdil12 ,dougsparling ,DrSegatron ,Votyer ,frankoid ,Frank071 ,gburca ,GuillaumeSmaha ,helmo ,JacZig ,mruwek ,PiwwowPants ,Jan-Bart ,Vliegendehuiskat ,jott ,jd-boyd ,JoelTroch ,pahakalle ,Karlson2k ,kwon37xi ,Levrifon ,LeoColomb ,typingArtist ,MaximeMenotti ,mmehnert ,BotQ ,MJ10 ,monopatis ,WebSpider ,OllieTerrance ,voda ,haselwarter ,rtreffer ,richardneish ,Riverside14 ,rbayer ,devRohanGarg ,rom1v ,sanderbaas ,sjbarag ,pelya ,sirtao ,SreyasRangaraju ,svenstaro ,the0ne ,grote ,vatsalsura ,vuntz ,vipsy ,mvitaly ,vog ,yarikoptic ,ascob ,blackbox87 ,msharp1 ,chamonkey ,Denis1990 ,eperez ,erlendorf ,gaionim ,github201407 ,gymka ,harjot-oberai ,humazed ,jcontno ,joelowj ,juliakorbut ,levysiqueira ,m5w6 ,jmeinke ,micah ,miplopez ,moparisthebest ,notfoss ,rpimonitrbtch ,xshadow ,shonramamurthy ,ciskeboekelo ,vgezer ,yulin2
ir.hsn6.k2; HassanHeydariNasab; k2; HassanHeydariNasab ,bla-ke ,Poussinou
com.fsck.k9.material; scoute-dich; K9-MailClient; scoute-dich ,Linuspogo ,Primokorn ,bebehei ,danialbehzadi ,Flippylosaurus ,Jan02 ,marmistrz
vnd.blueararat.kaleidoscope6; prrt714; Kaleidoscope; prrt714
com.jorgecastillo.kanadrill; jorgecastillo; KanaDrill; Error: repos/jorgecastillo/KanaDrill/contributors was not found..
in.andres.kandroid; andresth; Kandroid; andresth ,richardneish ,EstebanMonge ,gonzalobustos ,naofum
org.kaqui; blastrock; kaqui; blastrock ,Poussinou
com.kunzisoft.keepass.libre; Kunzisoft; KeePassDX; bpellin ,J-Jamet ,toluse ,TwinProduction ,bboa ,MaDill ,bparmentier ,YSmhXQDd6Z ,Pytlicek ,vhschlenker ,spacecowboy ,andriykopanytsia ,cschlyter ,JanThomas118 ,maikalms ,shanempope ,tadd ,dgarciabad ,zygimantus ,RaptorTFX ,yulin2 ,filimonic ,crr0004 ,Credomo ,EdlerProgrammierer ,Eegee ,FrederikSvarre ,matsuu ,ldmpub ,bumper314 ,drizzt ,asm0x ,codeprof ,meviox ,pepeEL ,riksa
