App ID;Repo Owner;Repo Name;Contributors
ca.rmen.android.networkmonitor; caarmen; network-monitor; caarmen ,BoD ,motorolja ,igloochef ,licaon-kter ,Poussinou
org.schabi.newpipe; TeamNewPipe; NewPipe; theScrabi ,weblate ,karyogamy ,mauriciocolli ,gregarkhipov ,medavox ,Freddynic159 ,naofum ,urmatej ,TobiGr ,MoonfireSeco ,pejakm ,edcaron ,antonv6 ,coffeemakr ,d9h20f ,r2308145 ,comradekingu ,satiricon ,marulinko ,emintufan ,wb9688 ,eighthave ,se7entime ,smarquespt ,zmni ,Riotism ,ema-pe ,roybaer ,darkon5 ,enolp ,RobinvanderVliet ,monolifed ,Duppadaadadii ,osoitz ,yfdyh000 ,be-neth ,oscarascal ,the-best-dev ,mueller-ma ,Vistaus ,BoFFire ,krux3r ,MarcRiera ,nautilusx ,tro69 ,loiemilio ,ScratchBuild ,rrooij ,TheAssassin ,kamadi ,arispoloway ,Generator ,Jojonintendo ,Bazsalanszky ,yarons ,Ashanmaril ,mg6 ,zhaofengli ,shekhar12020 ,cozyplanes ,SantosSi ,Xenotium ,Neraeh ,912d ,adelolmo ,ata2001 ,dcoder-mm ,coin3x ,dklobucaric ,Jiikuy ,Mortifer33 ,raveeolee ,aladar42 ,alexandrepa ,devnoname120 ,k3b ,ngoisaosang ,rr-vesp ,theN3GI ,algoprog ,danialbehzadi ,delold ,EnricoMonese ,Floflr ,ZerataX ,mikaeltauros ,RACER-JP ,narutosanjiv ,slm ,thejeshgn ,lavendthomas ,velitasali ,QuadTriangle ,Syl0s ,123vipulj ,echelonx ,SpajicM ,beriain ,bruwalfas ,jaller94 ,DanteAndroid ,dawidd6 ,vybuivn ,Nutomic ,Grammost ,jomaeso ,mobtechpd ,SilverLuke ,MathiasOP ,subet ,nigelinux ,OleksandrLos ,burunduk ,R3DJOK3R1 ,Pablohn26 ,Poussinou ,rex07 ,rboninsegna ,rogersachan ,Rubbix ,sebras ,przmkg ,ponypower ,alekksander ,drgsh ,gensitu ,justanidea ,lolloCreator ,nagizade ,nieko-nera ,pawelkw ,rapi3 ,trmdi ,lvdota ,wojcik-online ,slsimic ,ngawidev ,Jawnnypoo ,42SK ,Adam77Root ,adriancampos ,moshpirit ,RealAestan ,arielshulman ,Stokkie64 ,benediktg ,bvolkmer ,PurgingPanda ,BurningKarl ,Ealhad ,epitron ,FiloSpaTeam ,DafabHoid ,bla-ke ,devux ,digiwizkid ,Natureshadow ,Sgt-Miller ,faridk ,gjedeer ,ggppjj ,stelariusinfinitek ,georgenetu ,Gracecr ,HardLight ,jlelse ,jaytj95 ,s8321414 ,devfreedom ,jossiwolf ,kammodze ,Koleon ,LNJ2 ,larjona ,lucaskedrines ,marcobiscaro2112 ,Massedil ,MGralka ,mamins1376 ,somebelse ,chiinau ,OrNicarZ ,abn-volk ,Praveen0899 ,renensk ,KeizerDev ,ReportingRaccoon ,stnby ,TheLastProject ,medeirosT ,timofonic ,szafir1100 ,martykan ,TotalCaesar659 ,tryton-vanmeer ,utkb ,SpiderParker ,Wiredframe ,Xuacu ,blacklightwork ,developerchan1 ,fr3ts0n ,haseoxth ,hatsunearu ,hydroid7 ,intrnl ,lawonga ,maruyuki ,marxsouza12 ,nonamebg ,Shan11812 ,sirekanyan ,Saadsmh ,imallan ,tony8077616
com.newsblur; samuelclay; NewsBlur; samuelclay ,dosiecki ,roycyang ,manderson23 ,Dejal ,nriley ,lance0428 ,sv0 ,fake-name ,jefftriplett ,mihaip ,jrottenberg ,alliepape ,zerodogg ,AlphaCluster ,frac ,da2x ,francois2metz ,mortonfox ,itsaboutcode ,Diablo-D3 ,brainwane ,jv2222 ,lhagan ,sbilly ,heliostatic ,jmorahan ,raorn ,anisse ,AsaAyers ,calebegg ,Lukasa ,Daniel-Hug ,davidwilemski ,Flameeyes ,djc ,gms8994 ,hawkrives ,jryans ,linnet ,joeyg ,lgp171188 ,Laptop765 ,Livven ,mdaniel ,Zaspire ,wronglink ,peelman ,pabloav ,Phoenixsong ,Poussinou ,sillygwailo ,richardfearn ,wombleton ,samford ,quad ,seh ,t-8ch ,TopCruiser ,ambirex ,menakite ,cmchap ,creiner ,carlchen0928 ,daanzu ,hnrd ,stevenatwork ,thinkpoop
com.nextcloud.client; nextcloud; android; AndyScherzinger ,davivel ,tobiasKaminsky ,mario ,owncloud-bot ,nextcloud-bot ,jabarros ,przybylski ,LukeOwlclaw ,malkomich ,stoyicker ,purigarcia ,DeepDiver1975 ,divayprakash ,davigonz ,aleister09 ,comradekingu ,ardevd ,MorrisJobke ,rhari991 ,LukasReschke ,Spacefish ,Flole998 ,apicellaj ,magsjoq ,sassman ,zmatsuo ,vnidens ,sudhirkhanger ,loripino21 ,srkunze ,jancborchardt ,ekeitho ,xXSTrikeXx ,rperezb ,jesmrec ,Pro9 ,abhi472 ,MMMarcy ,stalker314314 ,danimo ,atomtigerzoo ,mabkenar ,grecep ,javiergonzper ,Kernald ,ogasser ,zerginator ,justin-sleep ,tanvidadu ,eppfel ,nickvergessen ,Mik- ,arundhati24 ,dontcallmedom ,esafirm ,s17t ,jospoortvliet ,Mic92 ,darth-tux ,Bubu ,MariusBluem ,pmarasse ,fi3te ,strugee ,privatereese ,espenaf ,florian-f ,harshika-arya ,josechoy ,djubreel ,kruton ,M1dgard ,rhabbachi ,fluffy88 ,codedsun ,realdeadfish ,tilosp ,wakeup ,Wikinaut ,b-harper ,carstendev ,mueller-ma ,nayangupta824 ,ryanwr ,ymage
org.schabi.nxbookmarks; theScrabi; OCBookmarks; theScrabi ,stefan-niedermann ,dan0xii ,Poussinou ,AndyScherzinger ,wevcode ,vit1-irk
com.nextcloud.android.beta; nextcloud; android; AndyScherzinger ,davivel ,tobiasKaminsky ,mario ,owncloud-bot ,nextcloud-bot ,jabarros ,przybylski ,LukeOwlclaw ,malkomich ,stoyicker ,purigarcia ,DeepDiver1975 ,divayprakash ,davigonz ,aleister09 ,comradekingu ,ardevd ,MorrisJobke ,rhari991 ,LukasReschke ,Spacefish ,Flole998 ,apicellaj ,magsjoq ,sassman ,zmatsuo ,vnidens ,sudhirkhanger ,loripino21 ,srkunze ,jancborchardt ,ekeitho ,xXSTrikeXx ,rperezb ,jesmrec ,Pro9 ,abhi472 ,MMMarcy ,stalker314314 ,danimo ,atomtigerzoo ,mabkenar ,grecep ,javiergonzper ,Kernald ,ogasser ,zerginator ,justin-sleep ,tanvidadu ,eppfel ,nickvergessen ,Mik- ,arundhati24 ,dontcallmedom ,esafirm ,s17t ,jospoortvliet ,Mic92 ,darth-tux ,Bubu ,MariusBluem ,pmarasse ,fi3te ,strugee ,privatereese ,espenaf ,florian-f ,harshika-arya ,josechoy ,djubreel ,kruton ,M1dgard ,rhabbachi ,fluffy88 ,codedsun ,realdeadfish ,tilosp ,wakeup ,Wikinaut ,b-harper ,carstendev ,mueller-ma ,nayangupta824 ,ryanwr ,ymage
de.luhmer.owncloudnewsreader; owncloud; News-Android-App; David-Development ,owncloud-bot ,DeepDiver1975 ,schaal ,cemrich ,nextcloud-bot ,b3nson ,stefan-niedermann ,wakeup ,jwaghetti ,MorrisJobke ,comradekingu ,theScrabi ,keithzg ,mario ,tobiasKaminsky ,anagno ,innerand
fr.unix_experience.owncloud_sms; nerzhul; ownCloud-SMS-App; nerzhul ,nextcloud-bot ,enoch85 ,thfree ,svetlemodry ,stefan-niedermann ,pejakm ,AndyScherzinger ,agdg ,Liantefaron ,liweitianux ,krt16s ,MorrisJobke ,tobiasKaminsky ,est31
com.nextcloud.talk2; nextcloud; talk-android; mario ,nextcloud-bot ,AndyScherzinger ,tobiasKaminsky ,comradekingu ,abhi472 ,jospoortvliet ,MorrisJobke ,Poussinou
com.nextgis.mobile; nextgis; android_gisapp; 4eRTuk ,BishopGIS ,NikitaFeodonit ,simgislab ,RuslanKiselev ,KamilSvoboda ,picaosgeo ,ahiyo ,drnextgis ,Ghostant ,Kinda-me ,strobilurus ,JakobMiksch
com.pcinpact; AnaelMobilia; NextINpact-Unofficial; AnaelMobilia ,gbour ,xinxinxinxinxin ,Poussinou
se.anyro.nfc_reader; nadam; nfc-reader; nadam ,Poussinou ,dnet ,fa18swiss
com.briankhuu.nfcmessageboard; mofosyne; NFCMessageBoard; mofosyne ,luiscruz ,Dinsmoor
moe.feng.nhentai; FengMoeTeam; NHentai-android; fython ,NotCR ,PeterCxy ,jordyamc ,alejandroIndacar ,Lemmmy ,baconForest ,livelazily ,multiverse2011 ,naofum ,Ruby-roo
com.digitallizard.nicecompass; okey666; NiceCompass; Error: repos/okey666/NiceCompass/contributors was not found..
com.corphish.nightlight.generic; corphish; NightLight; corphish ,GreyLeshy ,dom133 ,thermatk ,dennisxtria ,karanrajpal14 ,Grarak
org.michaelevans.nightmodeenabler; MichaelEvans; NightModeEnabler; MichaelEvans
info.papdt.blackblub; fython; Blackbulb; fython ,udnp ,ArchieMeng ,veyndan ,auroszx ,krt16s ,fatihunsever ,jonasbleyl ,Kasijjuf ,katrinleinweber ,Poussinou ,david082321 ,jrthsr700tmax ,kRkk
net.nitroshare.android; nitroshare; nitroshare-android; nathan-osman ,UsernameInvalidException ,techtonik ,boomt1337
com.afollestad.nocknock; afollestad; nock-nock; afollestad ,arose13 ,MSF-Jarvis ,anoymouserver
org.microg.nlp.backend.nominatim; microg; NominatimGeocoderBackend; mar-v-in ,be-neth ,n76 ,ale5000-git ,KAMiKAZOW ,daktak
com.nononsenseapps.notepad; spacecowboy; NotePad; spacecowboy ,fmelado ,ismailcarlik ,keima ,OlegKrikun ,jonasdiemer ,dunnkers ,WishuKaiser ,droustchev ,ekuler ,Ghir0 ,VladislavKoldobskiy ,gitter-badger ,ggao2014 ,qwertzdenek
io.github.tjg1.nori; tjg1; nori; tjg1 ,myozka ,gitmagic-bot ,Lonami ,Kycklingar ,lodyb ,Poussinou ,naofum
com.icechen1.notable.pro; icechen1; Notable; icechen1 ,jo-so ,AymanDF ,krt16s ,naofum
com.notecryptpro; RyuzakiKK; NoteCrypt; RyuzakiKK ,eugenioseveri ,naofum
nl.yoerinijs.notebuddy; YoeriNijs; NoteBuddy; YoeriNijs ,Poussinou ,naofum
com.tomaszmarzeion.notepad; szafir1100; drawable-notepad; szafir1100 ,tmarzeion ,koroshiya ,m-ezzat ,naofum ,mary-kate
com.simplemobiletools.notes; SimpleMobileTools; Simple-Notes; tibbi ,trubitsyn ,smarquespt ,Phoenix1747 ,mueller-ma ,chrjsorg ,canou ,smichel17 ,naofum ,vanitasvitae ,lna91 ,bla-ke ,en2sv ,gregory678 ,10cents ,FatihFIRINCI ,Flamingooo ,FriederZi ,ltGuillaume ,jesferman ,mobtechpd ,Poussinou ,rodymacedo ,Sopor- ,superusercode ,xmgz ,YSmhXQDd6Z ,anthologist ,fricyo ,julianaito ,kTyn9A9Kw3 ,zstartw
it.niedermann.owncloud.notes; stefan-niedermann; nextcloud-notes; stefan-niedermann ,korelstar ,nextcloud-bot ,dan0xii ,ageru ,fxedel ,proninyaroslav ,mario ,HeaDBanGer84 ,MorrisJobke ,Dobli ,pejakm ,comradekingu ,ilpianista ,AndyScherzinger ,alastify ,jancborchardt ,thenanobel ,YSmhXQDd6Z ,rakekniven ,schaarsc
org.secuso.privacyfriendlynotes; SecUSo; privacy-friendly-notes; Rdlgrmpf ,Yonjuni ,naofum
com.khuttun.notificationnotes; khuttun; NotificationNotes; khuttun ,RyDroid ,beriain ,pejakm ,twckr
org.surrel.facebooknotifications; gsurrel; FacebookNotifications; gsurrel ,hirvinen ,kashifo ,Poussinou
ca.rmen.nounours; caarmen; nounours-android; caarmen ,Poussinou
net.thauvin.erik.android.noussd; ethauvin; NoUSSD; ethauvin
me.shrimadhavuk.numselapp; SpEcHiDe; NoWhatOpen; Error: repos/SpEcHiDe/NoWhatOpen/contributors was not found..
org.ntpsync; free-software-for-android; NTPSync; dschuermann ,pejakm ,intrications
com.numguesser.tonio_rpchp.numberguesser; Reepeecheep; NumberGuesser; Reepeecheep ,afmachado
info.schnatterer.nusic; schnatterer; nusic; schnatterer ,naofum ,sebkur
net.justdave.nwsweatheralertswidget; justdave; nwsweatheralertswidget; justdave
cat.pantsu.nyaapantsu; NyaaPantsu; NyaaPantsu-android-app; akuma06 ,xdk78 ,ltype ,ewhal ,solinium
com.palliser.nztides; jevonlongdell; nztides; jevonlongdell
dk.jens.backup; jensstein; oandbackup; jensstein ,smarquespt ,nikwen ,sebastian05067 ,danielmmmm ,necioerrante ,temtemy ,aelmahmoudy
trikita.obsqr; trikita; obsqr; zserge ,krugloid ,anthologist
fr.s3i.pointeuse; alandais; Pointeuse_S3I; alandais
org.shirakumo.ocelot; Shirakumo; ocelot; Shinmera ,Poussinou
email.schaal.ocreader; schaal; ocreader; schaal ,stefan-niedermann ,Bridouz ,eloo ,thfree ,tobiasKaminsky ,loi219
com.gh4a; slapperwan; gh4a; maniac103 ,slapperwan ,Tunous ,kageiit ,Unpublished ,smichel17 ,greexon ,Tommy-Geenexus ,cketti ,thermatk ,avdv ,DDRBoxman ,edyesed ,jmue ,zquestz ,The-Fireplace ,Kvaibhav01 ,viktorstrate ,l2dy ,dimqua ,lightonflux ,suan
org.gateshipone.odyssey; gateship-one; odyssey; gnome17 ,djselbeck ,KowalskiOmniROM ,dankan1890 ,bla-ke ,dennisguse ,licaon-kter ,mray
org.sufficientlysecure.localcalendar; SufficientlySecure; offline-calendar; dschuermann ,harsel ,jgriffiths ,krt16s
org.ogre.browser; OGRECave; ogre; paroj ,davidjrogers ,sinbad ,assaframan ,wolfmanfx ,holocronweaver ,darksylinc ,philiplb ,sajty ,spacegaier ,RileyA ,praetor ,scrawl ,sasurobert ,TheNicker ,noamgat ,msari-ipe-ext-1 ,eugenegff ,quiasmo ,davidrogers-unity ,jorrit5477 ,fbridault ,SNiLD ,Mikarnage ,Klaim ,erikogenvik ,Spire42 ,TV4Fun ,SerVerXPlanet ,OgreTransporter ,mrhota ,Alexpux ,fschopp ,skogler ,stefaniapedrazzi ,zaidka ,LMCrashy ,marko213 ,alreay ,threax ,BAntDit ,bkchr ,djreep81 ,DarkSlark ,nikolaykasyanov ,digimatic ,Strachu ,brendor ,clynamen ,niparx ,tangshi ,arroy ,andrewfenn ,bohdankornienko ,danielgouvea ,Nodrev ,tE3rDA77Sr4WdyTH ,0xc0deface ,mdias ,jansenm ,buresu ,OleksiyA ,erincandescent ,binarycrusader ,svenstaro ,al2950 ,kPYKx7Ddw4n1aIKZ ,xantares ,wjwwood ,petrocket ,alexeyknyshev ,ali1234 ,greimela ,bcsanches ,Rojuinex ,DainiusVaiksnys ,davedissian ,dcarlus ,deniskoronchik ,romeoxbm ,GauthierPLM ,glennra ,JackStocker ,dumganhar ,jpoag ,TheSHEEEP ,jserve ,grim210 ,cyrfer ,Shenjoku ,lvella ,MakoEnergy ,hrw ,Martin-Idel ,Robert42 ,betajaen ,samhocevar ,stoulouse ,Seranth ,scpeters ,TheOnlyJoey ,TTimo ,tkausl ,webshinra ,wj98 ,dfrizel ,feiyunw ,majic79 ,nxgraphics ,Hotshot5000 ,Tiggilyboo
com.ogsdroid; nathanj; ogsdroid; nathanj
org.openintents.filemanager; openintents; filemanager; veniosg ,peli0101 ,friedger ,rmceoin ,the-best-dev ,Dexteroo7 ,vaibhav3011 ,andrew659 ,joriswit ,k3b
org.openintents.flashlight; openintents; flashlight; peli0101 ,shalinshah1993 ,friedger ,aperomsik
org.openintents.notepad; openintents; notepad; peli0101 ,friedger ,the-best-dev ,rmceoin ,stebeh ,aperomsik ,Ganz7 ,harshadura
org.openintents.shopping; openintents; shoppinglist; peli0101 ,aperomsik ,friedger ,rmceoin ,m-ezzat ,RuthAlk
it.feio.android.omninotes.foss; federicoiosue; Omni-Notes; federicoiosue ,Dima-1 ,Guybrush-The-Threepwood ,itsAmr ,thewhitetulip ,oMolloMo ,antoinesaliba ,relf218 ,mncl300 ,AgiMaulana ,richardzhanguw ,HiramLevitch ,waffle-iron ,Poussinou ,bryant1410 ,ian-tab ,mafenet ,pylerSM
com.github.onetimepass; OneTimePass; OneTimePass; kckrinke
com.nicue.onetwo; ndleyton; OneTwo; ndleyton ,naofum
org.openobservatory.ooniprobe; TheTorProject; ooniprobe-android; lorenzoPrimi ,bassosimone ,hellais ,agrabeli ,frankcash ,Lymphatus ,Poussinou ,TeMuNiDe
openfoodfacts.github.scrachx.openbeauty; openfoodfacts; openfoodfacts-androidapp; teolemon ,itchix ,herau ,PrajwalM2212 ,Karljoones ,huzaifaiftikhar ,Shubham2320 ,ross-holloway94 ,jaztriumph ,l-o-b-s-t-e-r ,samagra14 ,iml-v ,shivanshsoni ,Arshilgenius ,ManavPoddar ,ManognaMutyala ,jinqian ,ChasakisD ,NasiaKouts ,naofum ,policorn ,sachincool ,Farbklex ,amanjeetsingh150 ,HummingBrid ,danzzen ,sowmya9029 ,PO15ON ,MohamedHefny ,vaishali51 ,alikyo ,adamfils ,JohnAZoidberg ,friedger ,geocohn ,mehroshmmm ,mostafa07 ,Cypresslin ,codetriage-readme-bot ,roychowdhuryrohit-dev ,SatyamBansal ,AbsolutelySaurabh ,loominade ,oricdev ,doomers ,shushilkumarr ,tjwhm
io.github.sanbeg.flashlight; sanbeg; flashlight; sanbeg ,watsonrelay
com.gunshippenguin.openflood; GunshipPenguin; open_flood; verdulo ,GunshipPenguin ,lna91 ,laCour ,Ceeee ,raatmarien ,simonesestito ,xinxinxinxinxin
openfoodfacts.github.scrachx.openfood; openfoodfacts; openfoodfacts-androidapp; teolemon ,itchix ,herau ,PrajwalM2212 ,Karljoones ,huzaifaiftikhar ,Shubham2320 ,ross-holloway94 ,jaztriumph ,l-o-b-s-t-e-r ,samagra14 ,iml-v ,shivanshsoni ,Arshilgenius ,ManavPoddar ,ManognaMutyala ,jinqian ,ChasakisD ,NasiaKouts ,naofum ,policorn ,sachincool ,Farbklex ,amanjeetsingh150 ,HummingBrid ,danzzen ,sowmya9029 ,PO15ON ,MohamedHefny ,vaishali51 ,alikyo ,adamfils ,JohnAZoidberg ,friedger ,geocohn ,mehroshmmm ,mostafa07 ,Cypresslin ,codetriage-readme-bot ,roychowdhuryrohit-dev ,SatyamBansal ,AbsolutelySaurabh ,loominade ,oricdev ,doomers ,shushilkumarr ,tjwhm
com.tasomaniac.openwith.floss; tasomaniac; OpenLinkWith; tasomaniac ,Poussinou
com.nexes.manager; nexes; Android-File-Manager; 
com.todobom.opennotescanner; ctodobom; OpenNoteScanner; ctodobom ,Claudinux ,yarons ,franciscot ,nebulon42 ,Skydragonsz ,gmackenzie ,guillaume-roche ,hannesss81 ,Reylak ,nicolas-raoul ,ASMfreaK ,brenard ,mattkhaw ,naofum ,nigelinux ,nikoss
org.openpetfoodfacts.scanner; openfoodfacts; openfoodfacts-androidapp; teolemon ,itchix ,herau ,PrajwalM2212 ,Karljoones ,huzaifaiftikhar ,Shubham2320 ,ross-holloway94 ,jaztriumph ,l-o-b-s-t-e-r ,samagra14 ,iml-v ,shivanshsoni ,Arshilgenius ,ManavPoddar ,ManognaMutyala ,jinqian ,ChasakisD ,NasiaKouts ,naofum ,policorn ,sachincool ,Farbklex ,amanjeetsingh150 ,HummingBrid ,danzzen ,sowmya9029 ,PO15ON ,MohamedHefny ,vaishali51 ,alikyo ,adamfils ,JohnAZoidberg ,friedger ,geocohn ,mehroshmmm ,mostafa07 ,Cypresslin ,codetriage-readme-bot ,roychowdhuryrohit-dev ,SatyamBansal ,AbsolutelySaurabh ,loominade ,oricdev ,doomers ,shushilkumarr ,tjwhm
de.skubware.opentraining; chaosbastler; opentraining; chaosbastler ,Mic92 ,rolandgeider ,thypon ,naofum
com.dkanada.openapk; dkanada; OpenAPK; javiersantos ,dkanada ,georgenetu ,yaa110 ,Poussinou ,matteoarrighi
net.opendasharchive.openarchive.release; OpenArchive; openarchive; n8fr8 ,micahjlucas ,vitriolix ,mattl ,foundscapes ,christxph
be.brunoparmentier.openbikesharing.app; bparmentier; OpenBikeSharing; bparmentier ,frazzmark ,gensitu ,jsmakaayb ,thesebas ,comradekingu ,fabmazz ,naofum ,canerbasaran ,pataquets ,urbalazs ,yarons ,SantosSi ,sebras ,weblate ,benoitrion ,eskerda ,Omaranwa
org.openbmap.unifiedNlp; wish7code; org.openbmap.unifiedNlpProvider; wish7code ,daktak ,naofum ,thuryn
at.tomtasche.reader; TomTasche; OpenDocument.droid; TomTasche
org.opengappsdownloader; daktak; opengapps_downloader; daktak
org.openhab.habdroid; openhab; openhab-android; belovictor ,mueller-ma ,digitaldan ,maniac103 ,openhab-bot ,FlorianSW ,lolodomo ,Br3nda ,cribskip ,jvitkauskas ,ThomDietrich ,slawekjaranowski ,boc-tothefuture ,hazzeh ,dominicdesu ,SJoWie80 ,karafyllidis ,CristianSarac ,fat-tire ,ibaton ,mgarciate ,sosandroid ,digitaldaniel ,edgiru ,fspiekermann ,syphr42 ,friek ,watou ,JosSchering1 ,LukeOwlclaw ,aleon-albs ,Maurits28 ,robnielsen ,Snickermicker ,rusitschka ,TheNetStriker ,wborn ,zacharyyy ,naofum ,redeye86 ,rmichalak ,schinken
org.openhab.habdroid.beta; openhab; openhab-android; belovictor ,mueller-ma ,digitaldan ,maniac103 ,openhab-bot ,FlorianSW ,lolodomo ,Br3nda ,cribskip ,jvitkauskas ,ThomDietrich ,slawekjaranowski ,boc-tothefuture ,hazzeh ,dominicdesu ,SJoWie80 ,karafyllidis ,CristianSarac ,fat-tire ,ibaton ,mgarciate ,sosandroid ,digitaldaniel ,edgiru ,fspiekermann ,syphr42 ,friek ,watou ,JosSchering1 ,LukeOwlclaw ,aleon-albs ,Maurits28 ,robnielsen ,Snickermicker ,rusitschka ,TheNetStriker ,wborn ,zacharyyy ,naofum ,redeye86 ,rmichalak ,schinken
org.schabi.openhitboxstreams; theScrabi; OpenHitboxStreams; theScrabi
org.sufficientlysecure.keychain; openpgp-keychain; openpgp-keychain; dschuermann ,Valodim ,thi ,adithyaphilip ,ashh87 ,runnerway ,mar-v-in ,thialfihar ,nmikhailov ,uberspot ,timbray ,esclear ,hagau ,honnel ,danielhass ,artbristol ,alexfjw ,af-anssi ,tobsbot ,josecastillo ,mb-14 ,hav3n ,Emantor ,greg-witczak ,Hiperzone ,007durgesh219 ,rhari991 ,bcbarnes-gmx ,vectorijk ,bhargavgolla ,droidchef ,sreeram-boyapati ,vhazali ,LuboViluda ,fiaxh ,ajit766 ,kalkin ,kentnek ,doits ,danielnelz ,jessicayuen ,kartikarora ,eighthave ,lezorich ,Poussinou ,TheLugal ,tharinduwijewardane ,erbsenmann ,FVershinin ,iseki-masaya ,mgeier63 ,rohands ,xSooDx ,advaita13 ,felixb ,atsb ,ishit ,kbsriram ,0-kaladin ,jellysheep ,mdietz ,indrora ,Franzaine ,daquexian ,ligi ,unyoungwax ,vanitasvitae ,steelman ,AlexanderS ,cketti ,pampa ,gim- ,ankushb92 ,ecki ,iNPUTmice ,m0rph3us1987 ,jkolo ,Jesperbk ,nekosune ,lverns ,waffle-iron ,pejakm ,Rrego6 ,icyflame ,vphantom ,TedaLIEz ,Vadiml1024 ,wiktor-k ,mj7007 ,moparisthebest ,ogasser ,rafaelav ,tdjogi010
com.benny.openlauncher; OpenLauncherTeam; openlauncher; BennyKok ,dkanada ,gsantner ,MFlisar ,EmmanuelMess ,antonv6 ,sidhenidon ,comradekingu ,axet ,vakabus ,mastrgamr ,Therhokar ,klauf ,scoute-dich ,belkacem77 ,Primokorn ,milouse ,flocke ,RockyTV ,Generator ,conrad-heimbold ,xixiwelcome ,rain79 ,giobeatle1794 ,6A ,JAmixer ,Zagur ,joydeepsaha05 ,joeytwiddle ,Poussinou ,thalezirnho ,kRkk ,matteoarrighi ,naofum ,teal77
org.nv95.openmanga; nv95; OpenManga; nv95 ,baluluyakalulu ,McGars ,Skipytr ,kitwtnb ,Pavkazzz
org.redcross.openmapkit; AmericanRedCross; OpenMapKitAndroid; hallahan ,ccabanero ,imwongela ,dalekunce ,jasonrogena ,danbjoseph ,filbertkm ,naofum
de.uni_potsdam.hpi.openmensa; domoritz; open-mensa-android; domoritz ,jgraichen ,cmur2 ,cyroxx ,janrenz ,Harry-R ,picsel2
org.iilab.openmentoring; iilab; openmentoring-mobile; bsenyk ,jmatsushita
org.openorienteering.mapper; OpenOrienteering; mapper; dg0yt ,sikmir ,puzzlepaint ,weblate ,marczisi ,yevhenmazur ,jan-gerard ,sembruk ,krticka ,amalpeyre ,luhou ,naofum ,ogeo-project ,02JanDal ,Zerbembasqwibo ,Abbe98 ,comradekingu ,Symbian9 ,jsmakaayb ,PeterHoban ,arrizalamin ,russellporter ,lpechacek ,kjetilk ,yonkatz ,arifbobidinamik ,aivarszo ,mitchellkrome ,mlerjen ,zhibeizhen ,pafri ,marcovandersson ,guzh ,jayvdb ,jsvgoncalves ,chocochino ,petersuba ,Drake4478 ,Moonbood ,francojmf ,vladimircyclogaine ,wanacode ,adhikasp ,Ejdamm ,bluetiger9 ,cschive ,bagage ,JavierMF ,kfjellerup ,lizhaohou ,mpickering ,Nagykovacs ,peksi ,sgnewson ,okass ,pitchblack1 ,xc-racer99
com.example.openpass; ars3niy; openpass; ars3niy
jp.redmine.redmineclient; indication; OpenRedmine; indication ,box789 ,gape777 ,kmorinCL ,Poussinou ,gitter-badger ,elmanytas ,ka7
com.health.openscale; oliexdev; openScale; oliexdev ,erijo ,weblate ,linuxlurak ,wolkenschieber ,jflesch ,MilenaMMay ,MartinNowack ,MartinDroid ,ashimokawa ,DreamNik ,mapero ,MatoDroid ,roqeer ,p-bo ,Poussinou ,comradekingu ,JohnLines ,beothorn ,matushorvath ,Pablohn26 ,R3dThek ,SweetDonky ,cantruchd ,Murgeye ,SantosSi ,vogan
com.digitalfishfun.openshift; joonatoona; OpenShift; joonatoona ,Poussinou
cz.romario.opensudoku; romario333; opensudoku; romario333
org.dmfs.tasks; dmfs; opentasks; dmfs ,lemonboston ,korelstar ,nixprosoft ,katrinleinweber ,colegota ,dgoltzsche ,pejakm ,burunduk ,saschpe ,TobiasRe ,YSmhXQDd6Z ,tacsipacsi ,vellxn ,AlexandreHertzog ,Ezelty ,marcoh00 ,ethael ,Odeen ,PanderMusubi ,Poussinou ,SpiritCroc ,SweetLion ,UdoKifferbrehl ,meskal ,naofum
edu.killerud.kitchentimer; wkillerud; hiofenigma-android; wkillerud
de.blinkt.openvpn; schwabe; ics-openvpn; schwabe ,invalid-email-address ,maniac103 ,dzolnai ,hex539 ,SemenovAlexander ,Babar-Bashir ,mbg033 ,KwadroNaut ,lkorth ,msayson ,Poussinou ,stephengroat ,se-bastiaan ,chrihu ,sceneq ,wwweagle
de.digisocken.openwort; no-go; Wortschatz; no-go
com.orgzly; orgzly; orgzly-android; nevenz ,pxsalehi ,tulth ,MackieLoeffel ,fresheed ,Danesprite ,Sodel-the-Vociferous ,Endi1 ,sarg ,mamins1376 ,licaon-kter ,psamim
org.ethack.orwall; EthACKdotOrg; orWall; hgourvest ,cjeanneret ,colinmahns ,mremy ,Decio1 ,subtruth ,ahf ,moshpirit
info.guardianproject.browser; guardianproject; orweb; n8fr8 ,eighthave ,otr4j-travis-ci ,mbelinsky ,adam-p ,lioman ,moxie0 ,umazalakain ,moshpirit ,ticoombs
com.eolwral.osmonitor; eolwral; OSMonitor; eolwral ,xphnx ,chaitanya-lakkundi ,arthurzam ,pejakm ,Venryx ,equeim
org.billthefarmer.scope; billthefarmer; scope; billthefarmer
net.osmand.srtmPlugin.paid; osmandapp; Osmand; vshcherb ,weblate ,sonora ,jsmakaayb ,crimean ,AlexSyt ,PavelRatushnyi ,GaidamakUA ,Bars107 ,xmd5a2 ,verdulo ,ldmpub ,asereze ,jconstanti ,aceman444 ,unomano ,pavolzibrita ,dmpr0 ,franco999 ,robertogeb ,Chumva ,chobkwon ,adrianojbr ,alexey-pelykh ,elpresidento ,Nine-Tailed ,urmatej ,victorenator ,jf-simon ,FTno ,npalix ,osoitz ,prescott66 ,rododevr ,Jurkis ,andriuski ,skdhd ,yarons ,BathoryPeter ,Debeet ,stefanb ,hakuchi ,sveinki ,EmrahNebiyev ,KonfrareAlbert ,CJTmmr ,PaulStets ,0x2102 ,vantu5z ,massic80 ,franconian ,malkavi ,debyos ,LafarM ,BoFFire ,qqq3 ,pl71 ,damjang ,psokol ,stephan75 ,Brainik ,Zahnstocher ,rominf ,aitolos ,poretsky ,gerdami ,urbalazs ,Andygol ,ThePelgrim ,tandrus ,saeedghazijoolaee ,Nesimm ,rostdev ,IgorEliezer ,jmakovicka ,xosecalvo ,51114u9 ,dubyk ,Atalanttore ,korsunoleksandr ,naoliv ,crypto-rsa ,comradekingu ,krabaey ,afedasenka ,rezakhn ,nijel ,eighthave ,cipman ,hosiet ,quelbs ,yvecai ,sk-trav ,sanderd17 ,ecosyd ,bertm ,Barrocas ,osmand-steve ,mutipg ,andrew-davie ,onkarshinde ,saiarcot895 ,User99gmxat ,SantosSi ,Lesko987 ,enolp ,d9h20f ,szimszon ,njohnston ,jhertel ,AndreasTUHU ,stalker314314 ,yurkiss ,fooo0z0oool ,0ndrey ,jfitie ,nico202 ,burunduk ,Xuacu ,arlas ,pythonista ,milupo ,Xevib ,mippzon ,TheWartek ,seeebek ,fokin33 ,CarstenG ,Fahad-Alsaidi ,jmontane ,moceap ,olgashcherb ,gkfabs ,vmonkey ,bovirus ,jtrax ,ealain ,dmtrs32 ,gorkaazk ,fastestnoob ,tacsipacsi ,ireun ,smint80 ,NEOhidra ,Teiron ,rbovard ,Supaplextw ,skarmoutsosv ,fluks ,hvdwolf ,ffenix113 ,ruzenkadev ,alvm ,andrejz ,jenswinbladh ,mohabdul19 ,dgkwhite ,gintsgints ,razor74 ,xrazvan ,Xapitoun ,tonghuix ,clembeb ,zibik ,GiZig ,ilasica ,emintufan ,annasoloviova ,Edward17 ,rilaby ,qsypoq ,scrat95 ,ciubex ,gglowacki ,HishamO ,crami ,ypid ,theirix ,byshai ,mircozorzo ,jaller94 ,guilherme-peev ,ignaciolep ,liondog ,micechal ,polkillas ,S-Amiri ,Straputsky ,Txopi ,yogiks ,progserega ,Bikarhener ,cronoser ,alex73 ,claudiush ,goedson ,Jibec ,kadamski ,mpele ,spaetz ,tarcisiooliveira ,saindofora ,vrtareg ,amzaf ,mikhirev ,Costel21 ,iglezz ,jahedcuet ,StenSoft ,unhammer ,Mixaill ,pavlo-dudka ,assanges ,sjuniosilva ,ximex ,vilmantasr ,monolifed ,okilimu ,rogere66 ,sabas ,dubrovskip ,KJhellico ,KAMiKAZOW ,ugurk ,iAHTOH ,uryevich ,benediktg ,CarlosBrys ,CupIvan ,DrDimedrol ,botticchio ,xyhausen ,oxygenium ,walles ,jnumm ,mhamrle ,Kaddea ,Michael21011 ,GaMsh ,sikmir ,PanderMusubi ,pedrxd ,SafaAlfulaij ,simon04 ,7rTheSuperPotato ,umazalakain ,VasilisKos ,kodchi ,singleton4 ,star72 ,scaidermern ,arifakyol ,auloaasmaa ,Chistrouff ,ruleant ,AnotherFoxGuy ,Ghybu ,tornoz ,HamidTiouti ,jirkadanek ,joshtriplett ,joskohorvat ,huftis ,kcwu ,larjona ,marcositz ,mariyan-borisov ,miwie ,nabetaro ,OpenSourceForEver ,capaci ,rdoeffinger ,roirosal ,adown123 ,HattinkT ,strobeltobias ,toniher ,a-xin ,cepesko ,da3020 ,goshx ,hbogner ,malenki ,nautilusx ,osMatt ,Shikarno ,raz-dva3 ,velmyshanovnyi ,alexgabi ,allenlincg ,amalpeyre ,bvolkmer ,borceg ,BouRock ,chantoine ,ccreutzig ,Timon34 ,Dema
