App ID;Repo Owner;Repo Name;Contributors
net.osmand.plus; osmandapp; Osmand; vshcherb ,weblate ,sonora ,jsmakaayb ,crimean ,AlexSyt ,PavelRatushnyi ,GaidamakUA ,Bars107 ,xmd5a2 ,verdulo ,ldmpub ,asereze ,jconstanti ,aceman444 ,unomano ,pavolzibrita ,dmpr0 ,franco999 ,robertogeb ,Chumva ,chobkwon ,adrianojbr ,alexey-pelykh ,elpresidento ,Nine-Tailed ,urmatej ,victorenator ,jf-simon ,FTno ,npalix ,osoitz ,prescott66 ,rododevr ,Jurkis ,andriuski ,skdhd ,yarons ,BathoryPeter ,Debeet ,stefanb ,hakuchi ,sveinki ,EmrahNebiyev ,KonfrareAlbert ,CJTmmr ,PaulStets ,0x2102 ,vantu5z ,massic80 ,franconian ,malkavi ,debyos ,LafarM ,BoFFire ,qqq3 ,pl71 ,damjang ,psokol ,stephan75 ,Brainik ,Zahnstocher ,rominf ,aitolos ,poretsky ,gerdami ,urbalazs ,Andygol ,ThePelgrim ,tandrus ,saeedghazijoolaee ,Nesimm ,rostdev ,IgorEliezer ,jmakovicka ,xosecalvo ,51114u9 ,dubyk ,Atalanttore ,korsunoleksandr ,naoliv ,crypto-rsa ,comradekingu ,krabaey ,afedasenka ,rezakhn ,nijel ,eighthave ,cipman ,hosiet ,quelbs ,yvecai ,sk-trav ,sanderd17 ,ecosyd ,bertm ,Barrocas ,osmand-steve ,mutipg ,andrew-davie ,onkarshinde ,saiarcot895 ,User99gmxat ,SantosSi ,Lesko987 ,enolp ,d9h20f ,szimszon ,njohnston ,jhertel ,AndreasTUHU ,stalker314314 ,yurkiss ,fooo0z0oool ,0ndrey ,jfitie ,nico202 ,burunduk ,Xuacu ,arlas ,pythonista ,milupo ,Xevib ,mippzon ,TheWartek ,seeebek ,fokin33 ,CarstenG ,Fahad-Alsaidi ,jmontane ,moceap ,olgashcherb ,gkfabs ,vmonkey ,bovirus ,jtrax ,ealain ,dmtrs32 ,gorkaazk ,fastestnoob ,tacsipacsi ,ireun ,smint80 ,NEOhidra ,Teiron ,rbovard ,Supaplextw ,skarmoutsosv ,fluks ,hvdwolf ,ffenix113 ,ruzenkadev ,alvm ,andrejz ,jenswinbladh ,mohabdul19 ,dgkwhite ,gintsgints ,razor74 ,xrazvan ,Xapitoun ,tonghuix ,clembeb ,zibik ,GiZig ,ilasica ,emintufan ,annasoloviova ,Edward17 ,rilaby ,qsypoq ,scrat95 ,ciubex ,gglowacki ,HishamO ,crami ,ypid ,theirix ,byshai ,mircozorzo ,jaller94 ,guilherme-peev ,ignaciolep ,liondog ,micechal ,polkillas ,S-Amiri ,Straputsky ,Txopi ,yogiks ,progserega ,Bikarhener ,cronoser ,alex73 ,claudiush ,goedson ,Jibec ,kadamski ,mpele ,spaetz ,tarcisiooliveira ,saindofora ,vrtareg ,amzaf ,mikhirev ,Costel21 ,iglezz ,jahedcuet ,StenSoft ,unhammer ,Mixaill ,pavlo-dudka ,assanges ,sjuniosilva ,ximex ,vilmantasr ,monolifed ,okilimu ,rogere66 ,sabas ,dubrovskip ,KJhellico ,KAMiKAZOW ,ugurk ,iAHTOH ,uryevich ,benediktg ,CarlosBrys ,CupIvan ,DrDimedrol ,botticchio ,xyhausen ,oxygenium ,walles ,jnumm ,mhamrle ,Kaddea ,Michael21011 ,GaMsh ,sikmir ,PanderMusubi ,pedrxd ,SafaAlfulaij ,simon04 ,7rTheSuperPotato ,umazalakain ,VasilisKos ,kodchi ,singleton4 ,star72 ,scaidermern ,arifakyol ,auloaasmaa ,Chistrouff ,ruleant ,AnotherFoxGuy ,Ghybu ,tornoz ,HamidTiouti ,jirkadanek ,joshtriplett ,joskohorvat ,huftis ,kcwu ,larjona ,marcositz ,mariyan-borisov ,miwie ,nabetaro ,OpenSourceForEver ,capaci ,rdoeffinger ,roirosal ,adown123 ,HattinkT ,strobeltobias ,toniher ,a-xin ,cepesko ,da3020 ,goshx ,hbogner ,malenki ,nautilusx ,osMatt ,Shikarno ,raz-dva3 ,velmyshanovnyi ,alexgabi ,allenlincg ,amalpeyre ,bvolkmer ,borceg ,BouRock ,chantoine ,ccreutzig ,Timon34 ,Dema
org.gittner.osmbugs; Gittner; OSMBugs; ChristopherGittner
me.guillaumin.android.osmtracker; nguillaumin; osmtracker-android; nguillaumin ,maglnet ,SuborbitalPigeon ,jdmonin ,illarionov ,dittaeva ,andyhelp ,haggaie ,jakobmoellers ,andrew659 ,damndog ,dbrgn ,EmmanuelAB ,gkaklas ,zdila ,naoliv ,pshiryaev ,jamescr
com.infonuascape.osrshelper; ldionmarcil; OSRSHelper; TyMarc ,ldionmarcil
net.bierbaumer.otp_authenticator; 0xbb; otp-authenticator; 0xbb
com.luorrak.ouroboros; Luorrak; Ouroboros; Luorrak ,w0rp
nya.miku.wishmaster; miku-nyan; Overchan-Android; miku-nyan ,hey-red ,Kalaver ,ololoepepe ,sich95 ,weloxux ,Eilhart ,artemsmikh ,PwnicornDev
bus.chio.wishmaster; AliceCA; Overchan-Android; miku-nyan ,Eilhart ,AliceCA ,hey-red ,Kalaver ,ololoepepe ,sich95 ,weloxux ,lstyrtmrnbd ,artemsmikh ,Klaster1 ,PwnicornDev ,rngnrs
com.owncloud.android; owncloud; android; davivel ,owncloud-bot ,davigonz ,AndyScherzinger ,jabarros ,tobiasKaminsky ,przybylski ,LukeOwlclaw ,malkomich ,stoyicker ,purigarcia ,DeepDiver1975 ,jesmrec ,theScrabi ,sd1998 ,settermjd ,magsjoq ,sassman ,looploooop ,harshitbansal05 ,sudhirkhanger ,loripino21 ,rperezb ,ekeitho ,Pro9 ,MMMarcy ,danimo ,GurpreetSK95 ,LukasReschke ,grecep ,javiergonzper ,Kernald ,linakis ,zerginator ,Mik- ,dontcallmedom ,s17t ,jancborchardt ,Mic92 ,darth-tux ,ogasser ,pmarasse ,atsag ,frankFic ,michaelstingl ,akashagra ,ayushpateria ,espenaf ,hannesa2 ,nickvergessen ,JKawohl ,jospoortvliet ,kruton ,rhabbachi ,fluffy88 ,realdeadfish ,wakeup ,Wikinaut ,zhaofengli ,zmatsuo ,rishabh7m
org.schabi.nxbookmarks.owncloud; theScrabi; OCBookmarks; theScrabi ,stefan-niedermann ,dan0xii ,Poussinou ,AndyScherzinger ,wevcode ,vit1-irk
com.nbossard.packlist; nbossard; packlist; nbossard ,SusanKenneth ,PanderMusubi ,aitorres ,naofum
nu.firetech.android.pactrack; firetech; PactrackDroid; firetech ,blunden
com.mikifus.padland; mikifus; padland; mikifus ,Poussinou ,rugk ,naofum
net.nightwhistler.pageturner; NightWhistler; PageTurner; NightWhistler ,projectgus ,ryantm ,saik0 ,hoelzro ,tundebabzy ,nalor ,patrick-schweizer ,gregghz ,FayaJewel ,khajavi ,ThomasdenH ,anwaroman ,raphikBIS ,LuccoJ ,SkypLabs
com.kn.paper_foss_theme; beli3ver; Paper-FOSS-Theme; beli3ver ,dkanada ,jEsuSdA ,theScrabi
ru.valle.btc; ValleZ; Paper-Wallet; ValleZ ,naofum
de.devmil.paperlaunch; devmil; PaperLaunch; devmil ,Poussinou
com.alexcruz.papuhwalls; Papuh; PapuhWalls; jereksel ,Mazda-- ,flextrick ,enricocid ,KowalskiOmniROM ,KevinMinions ,sasikanth01 ,SusanKenneth
de.jkliemann.parkendd; jklmnn; ParkenDD; jklmnn ,Poussinou ,nek0 ,balzer82 ,johnjohndoe ,SaschaPeukert ,ThHareau
org.ligi.passandroid; ligi; PassAndroid; ligi ,cketti ,simontb ,guerda ,andrewlord1990 ,ilengyel
com.passcard; passcard4android; PassCard; cryptofuture ,passcard4android
gg.mw.passera; mwgg; passera; mwgg ,SweetLion
org.secuso.privacyfriendlypasswordgenerator; SecUSo; privacy-friendly-passwordgenerator; Yonjuni ,Henne1991 ,naofum
com.zeapo.pwdstore; zeapo; Android-Password-Store; zeapo ,wongma7 ,DSIW ,jbaiter ,felixb ,svetlemodry ,iAmiAdam ,kLeZ ,danielvandenberg95 ,betheg ,sdalu ,shgysk8zer0 ,zidhuss ,pirogoeth ,balasankarc ,bitdeli-chef ,BoFFire ,chrboe ,DanSnow ,crosser ,Kraymer ,ggarek ,jvenant ,languitar ,KevinSJ ,waffle-iron ,yantene ,tarciosaraiva ,gitter-badger ,bshkrv ,wiktor-k ,monkeywithacupcake ,lsowen ,mohammadnaseri ,naofum ,shanavas786 ,yowtsi ,Tunous
de.phoenixstudios.pc_dimmer; xn--nding-jua; PC_DIMMER_Android; xn--nding-jua
de.baumann.pdfcreator; scoute-dich; PDFCreator; scoute-dich ,naofum ,sebastian05067 ,licaon-kter
swati4star.createpdf; Swati4star; Images-to-PDF; Swati4star ,naofum ,Azooz2014 ,ishaandhamija ,flxwu ,shakeeb-xseed ,MarionaDSR ,mihudevcom ,codebu5ter ,rafaelph ,RakiRoad
peanutencryption.peanutencryption; goexle; peanutEncryption; goexle
de.j4velin.pedometer; j4velin; Pedometer; j4velin ,McGiverGim ,ogr3 ,alvarogzp ,Felix2yu ,alfonsorr ,NewJorg ,dotWee ,dbf256 ,AlonsoLP ,nikanorov ,anthonytex ,devpilot ,I3ck ,SweetLion ,avandorp ,kazuH ,naofum ,oXidFoX ,stankochetkov ,yoasif ,zenoven ,zygimantus
name.bagi.levente.pedometer; bagilevi; android-pedometer; bagilevi
org.secuso.privacyfriendlyactivitytracker; SecUSo; privacy-friendly-pedometer; tobiasneidig ,Yonjuni ,licaon-kter ,Lonami ,JonathanMM ,jclehner ,Poussinou ,Kamuno
com.frozendevs.periodictable; Frozen-Developers; android-periodic-table; lubo
de.arnowelzel.android.periodical; arnowelzel; periodical; arnowelzel ,JuliaJ999 ,valerio-bozzolan ,swmail ,cemrich ,naofum ,PanderMusubi ,Primokorn ,fermionic
com.byagowi.persiancalendar; ebraminio; DroidPersianCalendar; ebraminio ,behdad222 ,hamidsafdari ,La-Volpe ,amiaty ,abbas-oveissi ,catull ,danialbehzadi ,kilida
org.lf_net.pgpunlocker; PGPAuth; PGPAuth_Android; LittleFox94 ,DeX77
moe.minori.pgpclipper; Mnkai; PGPClipper; Mnkai ,LaruYan ,vanitasvitae
link.standen.michael.phonesaver; ScreamingHawk; phone-saver; ScreamingHawk ,psyanite ,amtlib-dot-dll ,naofum
com.quaap.phonefonefun; quaap; PhoneFoneFun; quaap
fr.s13d.photobackup; PhotoBackup; client-android; stephanepechard ,zealot128 ,devFozgul ,svetlemodry ,bitdeli-chef ,luiscruz ,gitter-badger ,naofum
com.ruesga.android.wallpapers.photophase; jruesga; PhotoPhase; jruesga ,mikeNG ,maniac103 ,ciwrl ,djMesias
dmusiolik.pijaret; MrFlyingToasterman; Pijaret; MrFlyingToasterman ,licaon-kter
org.secuso.privacyfriendlypin; SecUSo; privacy-friendly-pin-mnemonic; Yonjuni ,Kamuno ,naofum
com.pindroid; maxpower47; PinDroid; maxpower47 ,materemias ,karlicoss ,HelgePlaschke ,crasm ,jslag ,mrleolink ,Poussinou
io.github.fvasco.pinpoi; fvasco; pinpoi; fvasco ,danielecapursi ,naofum ,xinxinxinxinxin
org.olgsoft.apipepanic; rnauber; pipepanic-android; 
de.lihotzki.pixelflood; lukaslihotzki; pixelflood; lukaslihotzki
info.guardianproject.pixelknot; guardianproject; PixelKnot; harlo ,n8fr8 ,N-Pex ,eighthave ,abeluck ,mbelinsky ,Atalanttore
com.pixiv.muzei.pixivsource; dahlia; muzei-pixiv; d3m3vilurr ,dahlia ,krt16s
com.pjuu.otterdroid; pjuu; droidotter; docapotamus ,Poussinou ,gitter-badger
io.githubfede0d.planetrider; FEDE0D; Planet-Rider; FEDE0D
com.dftec.planetcon; dftec-es; planetcon; dftec-es ,RyDroid ,Poussinou
saschpe.poker; saschpe; PlanningPoker; saschpe ,Poussinou ,wolkenschieber
re.jcg.playmusicexporter; jcgruenhage; PlayMusicExporter; jcgruenhage ,Arcus92 ,mgillespie ,J05HI ,ddonuts4
com.cleveroad.sample; Cleveroad; PlayWidget; yatsinskiyCR ,jekaUA ,sy9999cr ,naofum
com.morlunk.mumbleclient; https:; ; Error: String cannot be empty
Parametername: name.;;;
eu.lavarde.pmtd; ericzolf; pmtd; 
com.utyf.pmetro; Utyff; pMetro; Utyff ,asdzxcasd
com.gmail.afonsotrepa.pocketgopher; afonsotrepa; PocketGopher; afonsotrepa ,parttimekatze
com.junjunguo.pocketmaps; junjunguo; PocketMaps; junjunguo ,Starcommander ,afmachado ,sebkur ,Poussinou ,chris-est
com.axelby.podax; thasmin; Podax; thasmin ,dbs ,brimstone ,f1ori ,yarikoptic ,eliovir
com.einmalfel.podlisten; einmalfel; PodListen; einmalfel ,paskalito
ca.rmen.android.poetassistant; caarmen; poet-assistant; caarmen ,BoD ,Poussinou
com.jmstudios.pointandhit.android; raatmarien; Point-and-Hit; raatmarien ,pheki
org.itishka.pointim; Tishka17; Point.im-Android; Tishka17 ,torgash-ivanblch ,lion4ik ,skobkin
eu.polarclock; beriain; PolarClock; beriain ,ChaosKid42 ,mueller-ma
com.polipoid; splondike; polipoid; splondike ,Poussinou
eu.veldsoft.politrics; TodorBalabanov; Politrics; TodorBalabanov
org.strawberryforum.pollywog; huckleberrypie; pollywog; huckleberrypie
science.itaintrocket.pomfshare; Nyubis; Pomfshare; Nyubis ,ewhal ,Scrxtchy ,lesderid ,neko
com.aaronjwood.portauthority; aaronjwood; PortAuthority; aaronjwood ,thanset ,Poussinou ,Jonathan727 ,fat-tire ,kdejgon ,pejakm ,Septolum ,licaon-kter ,naofum
com.xargsgrep.portknocker; xargsgrep; PortKnocker; xargsgrep ,TDFKAOlli ,Poussinou ,naofum
net.tevp.postcode; palfrey; postcode; palfrey ,Poussinou
com.mde.potdroid; janoliver; pOT-Droid; janoliver ,andreas-hofmann
org.ppsspp.ppsspp; hrydgard; ppsspp; hrydgard ,unknownbrackets ,xsacha ,raven02 ,thedax ,sum2012 ,Kingcom ,Ced2911 ,LunaMoo ,neobrain ,Orphis ,oioitff ,shenweip ,Xele02 ,tmaul ,daniel229 ,xebra ,mgaver ,lioncash ,kaienfr ,KentuckyCompass ,vnctdj ,Bigpet ,bollu ,danyalzia ,daniel-dressler ,makotech222 ,aquanull ,jacky400 ,PeterTh ,mikusp ,ufdada ,chinhodado ,jbeich ,artart78 ,tpunix ,pal1000 ,sergiobenrocha2 ,aliaspider ,MrYadro ,Kovensky ,CPkmn ,mrcmunir ,nachume ,aapo ,RisingFog ,angelXwind ,adrian17 ,CrazyMax ,arnastia ,cinaera ,jtraynham ,wuspring ,beaumanvienna ,rock88 ,zhykzhykzhyk ,zminhquanz ,PGGB ,achurch ,fireballwayne ,twinaphex ,LoungeKatt ,Darth1701 ,FireyFly ,juhalaukkanen ,larbb ,philipbutkiewicz ,latot ,hilesaz ,chaserhkj ,sky-zer ,szdarkhack ,xiushudongfang ,JimLee168 ,KingDuckZ ,neilmunday ,Nezarn ,nagisa ,bhavin192 ,Apology11 ,Enyby ,Krude ,m45t3r ,Vbif ,AkiraMiyakoda ,benclerix ,konistehrad ,myfreeweb ,Kenny4343 ,VIRGINKLM ,PoloqTV ,StorMyu ,ToadKing ,medicalwei ,yoshisuga ,mattweb28 ,bagnz0r ,imxieyi ,cyb3rm4n ,YaPeL ,Felix-Dev ,Florin9doi ,fcooper ,GuardianSoul ,joolswills ,ShiftyAxel ,mrordinaire ,Zetro ,dykebeard ,gigaherz ,amirzaim ,W-MS ,AdmiralCurtiss ,coestergaard ,MrColdbird ,psyke83 ,mvdan ,g2p ,JulianoAmaralChaves ,Kamisuke ,klyoungblood ,Kyhel ,KyousukeKyaa ,HomerSp ,motaz-alnuweiri ,Vality ,FTPiano ,chrisbrasington ,cv47 ,level99procrastinator ,adenovan ,webgeek1234 ,CarlKenner ,libcg ,reduxd ,salvprest ,leopard20 ,i25ffz ,phire ,substring ,Swyter ,solomonchild ,Whitexp ,clienthax ,elsonLee ,jeid3 ,kurdtkobain ,oscdis ,rasyid-irsyadi ,rnynoise ,thesourcehim ,vinanrra ,turbedi ,Sonicadvance1 ,173210 ,bentley ,barthalion ,BlackDogDog ,Bracket- ,chaoren ,Titouf2609 ,convalise ,duganchen ,Dzakus ,Atalanttore ,greenbagels ,leejuiping ,jefrsilva ,doggydogworld ,jimmyw ,potmdehex ,konchunas ,Maradonna90 ,mattkanwisher ,alucryd ,mikekov ,NCDyson ,PewnyPL ,VVVFO ,xiwo4525 ,notnotme ,SoulEst ,skardach ,toddbc ,tjhayasaka ,TotalCaesar659 ,vladkorotnev ,weerawat8597 ,neoh4x0r ,xsm1997 ,ydamigos ,yifanlu ,aroulin ,carroacelera ,codebase7 ,crocket ,debugzxcv ,dlee13 ,fgeds ,gouchi ,helloimowen ,kozec ,lg560852 ,macros5 ,mk22customg ,mschic ,mupralsh ,openglhk ,ravid1323 ,sails ,SeeK-ntr0py ,solarmystic ,tamatom ,theavengerr ,torque ,tywald ,wodencafe ,zack-vii ,Zixiken
com.metinkale.prayer; metinkale38; namaz-vakti-android; metinkale38 ,iSWORD ,luiscruz ,seyfullahbilgin
fr.simon.marquis.preferencesmanager; SimonMarquis; Android-PreferencesManager; SimonMarquis
damo.three.ie; DamienOReilly; PrepayCredit; DamienOReilly
eu.pretix.pretixdroid; pretix; pretixdroid; raphaelm ,ligi ,jfwiebe ,Bubu
com.smithdtyler.prettygoodmusicplayer; smithdtyler; prettygoodmusicplayer; bullmooseparty ,smithdtyler ,svetlemodry ,lna91 ,deveee ,undu ,richq ,pjotrligthart
uk.co.busydoingnothing.prevo; bpeel; prevo; bpeel
com.quaap.primary; quaap; Primary; quaap
org.primftpd; wolpi; prim-ftpd; wolpi ,codebymikey ,xphnx ,pierreduchemin ,cl0ne ,beriain ,abderrahim ,jlelse ,vagnum08 ,rramthun ,stefan-niedermann ,licaon-kter
org.us.andriod; andviane; prism; andviane ,Poussinou
protect.babymonitor; brarcher; protect-baby-monitor; brarcher ,shacharr ,naofum ,johanehnberg
com.phpsysinfo; phpsysinfo; psiandroid; rk4an ,McLalala ,mike2nl ,duhast ,MAFLO321 ,hoerup ,ChriZathens
ro.mihai.tpt; MihaiBalint; TimisoaraPublicTransport; MihaiBalint
sun.bob.leela; PuffOpenSource; Puff-Android; SpongeBobSun ,mBigFlower ,licaon-kter ,naofum
name.boyle.chris.sgtpuzzles; chrisboyle; sgtpuzzles; sgtatham ,chrisboyle ,jtn20 ,jonaskoelker ,doopl ,kevinlyles ,bwhacks ,neclepsio ,kaberett ,blgl ,kraj ,sunfall ,palfrey ,kilobyte
com.moez.QKSMS; qklabs; qksms; moezbhatti ,l3d00m ,mvdan ,CyanBlob ,Allsimon ,searchy2 ,harkin ,Robert-Cunningham ,StephaneBausseron ,LanderN ,lucyyu24 ,MyNameIsCosmo ,josephmangmang ,sm4rk0 ,tariq86 ,tdmitriy ,laysionqet ,topolar ,Jawnnypoo ,RomanHargrave ,srcreigh ,danielchristopher1 ,CoREse ,HashBang173 ,jnns ,JosephDRogers23 ,karlding ,xasos ,PeterChu2 ,Rexee ,rubenroy ,StephaneBausseronErcom ,gitter-badger ,timusus ,trevorhalvorson ,dethstar ,philcryer ,tivek ,kymjs
com.secuso.privacyFriendlyCodeScanner; SecUSo; privacy-friendly-qr-scanner; Yonjuni ,YannAries ,naofum ,p-rack ,vanMacG
com.github.xloem.qrstream; xloem; qrstream; xloem ,svetlemodry ,mofosyne
com.iskrembilen.quasseldroid; sandsmark; QuasselDroid; kenborge ,justjanne ,sandsmark ,mamarley ,mollerse ,allquixotic ,aziraphale ,MarcLandis ,magnuf ,MrCustomizer ,tupshin ,freqmod ,sgielen ,chirayudesai ,schaal ,nilscc ,adrianke ,Transfusion ,davidvollmar ,Earthwings ,Nevcairiel ,jbarop ,ShadowNinja ,stevesoltys ,wjp ,brotkastn
ohm.quickdice; Ohmnibus; quick-dice-roller; Ohmnibus
com.tomer.draw; rosenpin; QuickDrawEverywhere; rosenpin
de.reimardoeffinger.quickdic; rdoeffinger; Dictionary; rdoeffinger ,UweTrottmann ,antonv6 ,mueller-ma ,invalid-email-address ,larjona ,Heineken ,kvnco ,Kteby ,yourealwaysbe ,sdoerner ,naofum
vu.de.urpool.quickdroid; himmele; quickdroid; Himmele
com.geecko.QuickLyric; geecko86; QuickLyric; geecko86 ,svenoaks ,beschoenen ,farmerbb ,algmyr ,prashantkhurana ,shaunidiot ,geekywoman35 ,naofum
de.baumann.quitsmoking; scoute-dich; QuitSmoking; scoute-dich ,Primokorn ,naofum ,nuxnik
es.cesar.quitesleep; cesarvaliente; quitesleep; CesarValiente
com.frrahat.quransimple; frrahat; Quran-For-My-Android; frrahat
net.artificialworlds.rabbitescape; andybalaam; rabbit-escape; andybalaam ,colonelfazackerley ,tttppp ,GamingInky ,antonpiatek
com.markusborg.test; mrksbrg; RacketGhost; mrksbrg
org.openbmap; wish7code; openbmap; wish7code ,missbala ,weblate ,agilob ,amilopowers ,naofum ,yfdyh000 ,jsmakaayb ,CustardFlan ,uno20001 ,comradekingu ,AreYouLoco ,rboninsegna ,geant44
net.programmierecke.radiodroid2; segler-alex; RadioDroid; segler-alex ,Wikinaut ,avently ,werman ,zoff99 ,Poussinou ,centic9 ,SkewedZeppelin ,nikoss ,pvagner ,Fincer ,svetlemodry ,larjona ,canerbasaran ,corentin38 ,timonypumba
nl.implode.regenalarm; sanderbaas; rainalarm-android; sanderbaas
cc.rainwave.android; OEP; rainwave-android; OEP ,BreadMaker
de.eidottermihi.raspicheck; eidottermihi; rpicheck; eidottermihi ,larsgrefer ,yulin2 ,LJason77 ,Adaok ,ElCresh ,Mafarricos ,zoszkar ,Poussinou ,ijaron
io.github.engsergiu.react; engSERGIU; React; engSERGIU ,lu-x
io.github.baiatbun.react; baiatBun; React; engSERGIU ,lu-x
com.bleyl.recurrence; jonasbleyl; Recurrence; jonasbleyl ,Primokorn ,greizgh
com.jmstudios.redmoon; raatmarien; red-moon; smichel17 ,raatmarien ,cngu ,weblate ,naofum ,Swyter ,pejakm ,verdulo ,MiCoArcher ,twckr ,monolifed ,comradekingu ,Jawnnypoo ,EspadaV8 ,Leocadio94 ,emintufan ,matteocoder ,danialbehzadi ,AboShanab ,qv1x0te ,Kimjio ,foosen ,thanass ,PowZerR ,Reedych ,swalladge ,SpiritCroc ,Coehill ,javnik36 ,kjy00302 ,mesnevi ,techwebpd ,Therhokar ,Zoraver ,aablaablaa ,vx-i ,antonv6 ,dmaulat ,di72nn ,FredrikAugust ,ltGuillaume ,onuricen ,petrkle ,Rastikh ,kuoruan ,wb9688 ,AbdullZ7 ,boconnell ,Cj-Malone ,LNJ2 ,frankzheng43 ,hgs2000 ,mission712 ,Kasijjuf ,mobtechpd ,larjona ,elchevive ,mv-santos ,welaq ,nigelinux ,oguz-ismail ,rogersachan ,cobalt59 ,elumbella ,gwenhael-le-moine ,h0d ,homersimpsons ,kamadi ,pylerSM ,jdhao
au.com.wallaceit.reddinator; micwallace; reddinator; micwallace ,burntcookie90 ,aljp ,krt16s ,splitowo
com.github.redpanal.android; martinchodev; RedPanal-Android-WebApp; martinchodev
org.quantumbadger.redreader; QuantumBadger; RedReader; QuantumBadger ,dsgkirkby ,mvdan ,verdulo ,Clubfan22 ,veyndan ,chaitan94 ,moshpirit ,Thadah ,ishults ,Coehill ,cl0ne ,andrewgiang ,comradekingu ,kageiit ,cpalasanu ,evant ,BannerCoe ,mateoeh ,gaudecker ,mariokmk ,tjernquist ,fhtagn ,Andiho12 ,auroszx ,DogPawHat ,husam212 ,jmreyes ,klenje ,Beleg-Cuthalion ,SkewedZeppelin ,veeti ,ahomphophone ,ajgoda90 ,chippen ,gensitu ,gstraube ,kszlim ,samdroid-apps ,ajs124 ,andersonfernandes ,AwIDoK ,lna91 ,DubHunt ,christophertrml ,Rumel ,elmundio87 ,frederickfogerty ,GabrielCastro ,stelariusinfinitek ,H4rryA ,Aruee ,noughtmare ,0xKD ,Bragado ,LinkedList ,md-mariok ,malept ,meklu ,philipwhiuk ,RafaelAndrade0 ,remil19 ,sarbajitsaha ,Septolum ,ShadowNinja ,ThomasKomarnicki ,Toover ,trevor-e ,m3sv ,wosc ,andihorner ,awells111 ,badcrc ,c0d3st0rm ,jsmakaayb ,ktechmidas ,much-doge ,alex-vt ,vooctavian ,wb9688
org.vi_server.red_screen; vi; redscreen.apk; vi
com.phikal.regex; phikal; ReGeX; phikal ,nico202 ,PauBatlle ,lna91 ,afmachado ,Green-Sky ,dark159123 ,naofum
com.gacode.relaunchx; Leszek111; ReLaunchX; gamba69 ,Leszek111 ,avmdv ,jpawz ,tymofij ,yiselieren
com.lostrealm.lembretes; edsonduarte1990; reminders; edsonduarte1990
de.onyxbits.remotekeyboard; onyxbits; remotekeyboard; onyxbits
protect.rentalcalc; brarcher; rental-calc; brarcher ,naofum
com.futurice.android.reservator; futurice; meeting-room-tablet; vtainio ,joelmertanen ,ninjahoahong ,bklang ,izrailit ,bladealslayer ,nthcircle ,ojarva ,pedpess ,Sebastian-Hojas ,ttur ,ykarikos ,jonikarppinen ,phadej ,naofum
br.usp.ime.retrobreaker; m45t3r; retrobreaker; m45t3r ,xinxinxinxinxin ,notfoss
click.dummer.textthing; no-go; TextThing; no-go ,xinxinxinxinxin ,naofum
se.embargo.retroboy; mikljohansson; retroboy; mikljohansson ,Poussinou
org.retroshare.android.qml_app; RetroShare; RetroShare; csoler ,PhenomRetroShare ,G10h4ck ,invalid-email-address ,defnax ,mr-alice ,thunder2 ,electron128 ,RetroPooh ,zeners ,kdebiec ,AsamK ,felisucoibi ,hunbernd ,mestaritonttu ,chelovechishko ,cavebeat ,sehraf ,chozabu ,ericthefish ,realityfabric ,heini ,Nyfor ,myfingerhurt ,crhode ,Gottox ,Kcchouette ,Ppjet6 ,dartraiden ,aral ,BabushkaRetroShare ,cristeab ,bryongloden ,dali99 ,ngleb ,topcat ,hasufell ,beardog108 ,marcobarbosa16 ,diversys ,grennvyper ,Steve-V ,anontahoe ,Hopetech ,jolavillette ,cicicmanu ,pztrn ,sirjenster
io.mrarm.irc; MCMrARM; revolution-irc; MCMrARM
com.mantz_it.rfanalyzer; demantz; RFAnalyzer; demantz ,tomswartz07
com.fastebro.androidrgbtool; fasteque; rgb-tool; fasteque ,SnowVolf ,Poussinou
click.dummer.rickapp; no-go; RickApp; no-go
fr.keuse.rightsalert; cglapa; rights-alert; kyriog
com.ringdroid; google; ringdroid; nfaralli ,minorninth
im.vector.alpha; vector-im; riot-android; ylecollen ,pedroGitt ,sabrinaj ,dunetna ,sim6 ,general50 ,manuroe ,giomfo ,weblate ,jgkamat ,Tyuoli ,krombel ,nvbln ,0ndrey ,rbozhkova ,kaiyou ,osoitz ,bamstam ,mytbk ,lazz0 ,SafaAlfulaij ,xonel ,pvagner ,tonghuix ,RiotTranslate ,oddvar ,pacamara ,hidraulicChicken ,zecakeh ,szimszon ,d1d4c ,carlos-am ,ara4n ,elsieholmes ,jaylik ,manchalalakshmi ,viccuad ,barks-r1 ,yuurii ,dtygel ,Noromon ,anothersoftware-lv ,ndarilek ,Silvan87 ,dark159123 ,m4sk1n ,geomule ,erciccione ,erikjohnston ,JosephKiranBabu ,lupa18 ,oonid ,ptman ,BrianMwit ,thanostx ,libraryxhime ,licaon-kter ,reip161 ,gwenl ,alacrity26 ,suy ,oivoodoo ,erdnaxeli ,MurzNN ,shvchk ,monkeymagic29 ,babolivier ,ToferC ,christarazi ,Porkepix ,dbkr ,enricobacis ,dicer ,grigruss ,HostFat ,jkalousek ,jankudrik ,s8321414 ,CountZukula ,jooert ,Kegsay ,SLSX ,Kobberholm ,g438 ,luiscruz ,MTRNord ,vurpo ,Nadrieril ,schwindp ,rkfg ,severen ,slipeer ,pafcu ,alefteris ,anthologist ,aventrax ,cafade ,dva-re ,fallerOfFalls ,keithzg ,lsowen ,strixaluco ,xmeta ,zzottel ,vehery
info.guardianproject.ripple; guardianproject; ripple; eighthave
fr.hnit.riverferry; mdecorde; BAC76; mdecorde
se.norenh.rkfread; norenh; RKFRead; norenh
wseemann.media.romote; wseemann; RoMote; wseemann ,Poussinou
com.abcdjdj.rootverifier; abcdjdj; RootVerifier-APP; abcdjdj ,Abhinav1997 ,phhusson
org.penghuang.tools.rotationlock; phuang; RotationLock; phuang
com.ath0.rpn; lpar; RPN; lpar ,afmachado
org.scoutant.rpn; scoutant; rpn; scoutant ,Poussinou
marto.rtl_tcp_andro; martinmarinov; rtl_tcp_andro-; martinmarinov ,Enthusiastic-Coder
org.secuso.privacyfriendlyruler; SecUSo; privacy-friendly-ruler; rkolosovs ,Yonjuni ,Kamuno ,naofum
org.disrupted.rumble; Marlinski; Rumble; Marlinski ,Dbof ,PrasannaVenkadesh ,xoir ,makemeasandwich ,licaon-kter
org.runnerup; jonasoreland; runnerup; jonasoreland ,gerhardol ,bagage ,dhiltonp ,jonfre ,daverix ,johnlepikhin ,mattbostock ,nebmo ,fg1 ,seanrees ,rickyepoderi ,ixeft ,markcs ,pace6666 ,wbrenna ,callesol ,stribb ,CharString ,netmackan ,aaroncyoder ,darander ,filin2009 ,PanderMusubi ,gitter-badger ,skaldarnar ,blaudden ,Boerde
cri.sanity; awaken; sanity; awaken
org.ligi.satoshiproof; ligi; SatoshiProof; ligi
com.vonglasow.michael.satstat; mvglasow; satstat; mvglasow ,kadarivan ,davidgross ,barbeau ,octosquid ,User99gmxat ,afmachado ,ilarrain ,Poussinou ,eliovir ,julianaito ,vsandre
jonas.tool.saveForOffline; JonasCz; save-for-offline; JonasCz ,Poussinou ,albertincx
com.tttdevs.stncbookmarks; TTTDevs; NextCloudBookmarksAndroid; martinchodev
com.lukekorth.screennotifications; lkorth; screen-notifications; lkorth ,jbollacke
com.sagar.screenshift2; aravindsagar; ScreenShift; aravindsagar
info.dvkr.screenstream; dkrivoruchko; ScreenStream; dkrivoruchko ,Aerotinge ,Poussinou ,ScottBeeson ,atareao
com.orpheusdroid.screenrecorder; vijai1996; screenrecorder; vijai1996 ,DumF0rGaming ,Primokorn ,Poussinou
com.jotabout.screeninfo; mportuesisf; ScreenInfo; mportuesisf ,paulvi
uk.co.keepawayfromfire.screens; Cj-Malone; Screens; Cj-Malone ,naofum
com.tomer.screenshotsharer; rosenpin; Screenshot-Sharer; rosenpin ,Poussinou
eu.veldsoft.scribe4; TodorBalabanov; Scribe4; MatrixFrog ,LeeBreisacher ,TodorBalabanov
io.github.powerinside.scrollsocket; PowerInside; ScrollSocket; 
ca.rmen.android.scrumchatter; caarmen; scrumchatter; caarmen ,naofum ,r4dixx ,Poussinou
com.gmail.jerickson314.sdscanner; jerickson314; sdscanner; jerickson314 ,relan ,svetlemodry ,tomikmar ,dingens ,helfio ,valentind44
com.seafile.seadroid2; haiwen; seadroid; Logan676 ,lins05 ,forouher ,freeplant ,SaudM ,alfh ,0x64746b ,jsonchi ,asv000 ,amuttsch ,TMHBOFH ,matpat996 ,egroeper ,rcoss ,telmobarros ,FlorinPeter ,fxsc ,max32002 ,thecosmicfrog ,unverbraucht ,SweetLion ,maddin1 ,foxel ,emoitzi ,bagage ,teknoraver ,patcon ,shoeper ,gitter-badger ,to-ba ,thetraumer
com.quaap.fishberserker; quaap; SeafoodBerserker; quaap ,nikoss ,gsantner ,mquinson ,Poussinou
com.twistedplane.sealnote; vishesh; sealnote; vishesh ,akshatgoel ,Tamarindo94 ,paulle ,chadcurtis ,Poussinou ,drobatch ,faruktoptas ,naofum
com.vackosar.searchbasedlauncher; vackosar; search-based-launcher; vackosar ,ideasfrombrain ,takahirom
fr.simon.marquis.secretcodes; SimonMarquis; Android-SecretCodes; SimonMarquis ,ehooo
de.t_dankworth.secscanqr; Fr4gorSoftware; SecScanQR; Fr4gorSoftware ,beriain
fr.seeks; sileht; SeeksWidget; sileht
com.mrbimc.selinux; MrBIMC; SELinuxModeChanger; MrBIMC ,prescott66
mobi.omegacentauri.SendReduced; arpruss; sendreduced; arpruss
org.totschnig.sendwithftp; mtotschnig; SendWithFtp; mtotschnig ,lauco74 ,m-ezzat
org.mcxa.vortaro; ianmcxa; vortaro; ianmcxa ,Poussinou
